"product_id";"name";"categories";"main_categories";"sku";"upc";"location";"quantity";"model";"manufacturer";"image_name";"requires shipping";"price";"points";"date_added";"date_modified";"date_available";"weight";"unit";"length";"width";"height";"length unit";"status enabled";"tax_class_id";"viewed";"language_id";"seo_keyword";"description";"meta_description";"meta_keywords";"seo_title";"seo_h1";"stock_status_id";"store_ids";"layout";"related_ids";"tags";"sort_order";"subtract";"minimum"
"67";"Аккумуляторный степлер Bosch PTK 3,6 V";"1008";;"1343919830";;;"";;"";"data/67-118-thickbox.jpg";"yes";"110.00";0;"2009-02-03 16:06:50";"2012-02-27 06:55:31";"2009-02-03";;;;;;;"true";;;"1";;"<p>Забивание гвоздей и скоб длиной до 14 мм с мощным аккумулятором 3,6 В. PowerLight - при помощи встроенного светодиода рабочая поверхность заготовки будет всегда освещённой. Безопасное остриё - выполнение удара только в рабочем положении. Фронтальное расположение острия степлера для крепления близко к кромке, механическая установка силы удара с помощью регулировочного колёсика в зависимости от обрабатываемого материала. Эргономичная рукоятка с мягкой накладкой для неутомительной работы. Указатель количества скоб.</p>";;;"Аккумуляторный степлер Bosch PTK 3,6 V";"Аккумуляторный степлер Bosch PTK 3,6 V";7;0;;;;0;"true";1
"68";"Станок для резки плитки (плиткорез) Диолд СП-1,2-250";"1008";;"735422495";;;"";;"";"data/68-122-thickbox.jpg";"yes";"690.00";0;"2009-02-03 16:06:50";"2012-02-27 06:55:31";"2009-02-03";;;;;;;"true";;;"1";;"<p>Станок для резки плитки СП-1,2-250 предназначен для прямой и наклонной резки плиток, сделанных из керамического и подобного материла и относится к изделиям бытового назначения. В качестве рабочего инструмента используется алмазный отрезной диск с наружным диаметром 250 мм, посадочным диаметром 25,4 мм и шириной 2,4 мм. Станок предназначен для эксплуатации в районах умеренного климата, исполнения У, при температуре окружающего воздуха от плюс 35°С до минус 15°С. Режим работы станка повторно-кратковременный - 15/5мин. (15 мин. - работа, 5 мин. - пауза) Мощность - 1200 Вт.</p>";;;"Станок для резки плитки (плиткорез) Диолд СП-1,2-250";"Станок для резки плитки (плиткорез) Диолд СП-1,2-250";7;0;;;;0;"true";1
"69";"Электрический фрезер Bosch GOF 900 CE";"1008";;"1103189345";;;"";;"";"data/69-123-thickbox.jpg";"yes";"550.00";0;"2009-02-03 16:06:50";"2012-02-27 06:55:31";"2009-02-03";;;;;;;"true";;;"1";;"<p>Электрический фрезер мощностью 900 Вт. Константная электроника для обеспечения постоянной производительности. Точная регулировка глубины захода с точностью до 1/10 мм с функцией погружения. Регулировка числа оборотов. Система SDS.</p>";;;"Электрический фрезер Bosch GOF 900 CE";"Электрический фрезер Bosch GOF 900 CE";7;0;;;;0;"true";1
"76";"Проводная стерео гарнитура Sony Ericsson HPM-20";"1008";;"1628263280";;;"";;"";"data/76-136-thickbox.jpg";"yes";"15.00";0;"2009-02-03 16:06:50";"2012-02-27 06:55:31";"2009-02-03";;;;;;;"true";;;"1";;"<p>С оригинальными стерео наушниками и микрофоном достигается максимальная свобода движения во время разговора и прослушивания музыки.</p>";;;"Проводная стерео гарнитура Sony Ericsson HPM-20";"Проводная стерео гарнитура Sony Ericsson HPM-20";7;0;;;;0;"true";1
"9";"Холодильник ARDO GO 2210 BH HOMEPUB";"1009";;"795458685";;;"";;"";"data/9-20-thickbox.jpg";"yes";"11220.00";0;"2009-02-03 16:06:50";"2012-02-27 06:55:31";"2009-02-03";;;;;;;"true";;;"1";;"<p>Общий объем 316л.</p><p>Полезный объем холодильной камеры 218л</p><p>Полезный объем морозильной камеры 83л</p><p>Дозатор для пива:</p><p>Дверцы помимо обычных полок содержат специальные ниши, в которых находится система подачи пива.</p><p>Причем это не уменьшает полезное пространство для хранения продуктов!</p><p>Потребление электроэнергии (кВт/24ч) 0,70</p><p>Электронный модуль управления</p><p>1 компрессор</p><p>Автоматическое размораживание холодильного отделения</p><p>Ручное размораживание морозильного отделения</p><p>Антибактериальное покрытие</p><p>Поддержание температуры в случае отключения (ч) 18ч.</p><p>Кнопка быстрого замораживания</p><p>Индикатор критической температуры</p><p>Полки из сверхпрочного закаленного стекла</p><p>Полка для бутылок</p><p>Класс A+</p><p>Inox - нержавеющая сталь</p><p>Размеры в см:В185,5хШ60хГ67,2</p><p>Как обеспечить себя баллонами для Home Pub?</p><p>1. Вы покупаете Home Pub с заправленным баллоном. Home Pub, баллон и газ – продаются, как отдельные позиции. Кроме того, в любой момент Вы можете приобрести дополнительно заправленные баллоны.</p><p>2. Когда баллон (а это приблизительно 30 бочонков по 5л) у Вас опустошится, обратитесь в магазин, который торгует продукцией ARDO по предварительному заказу;</p><p>3. Вы сдаете пустой баллон, получаете полный и оплачиваете только заправку. Фирма-производитель оставляет за собой право на внесение изменений в конструкцию и комплектацию приборов.</p>";;;"Холодильник ARDO GO 2210 BH HOMEPUB";"Холодильник ARDO GO 2210 BH HOMEPUB";7;0;;;;0;"true";1
"20";"Вытяжка Elica ONICE IX + NOCE F90";"1009";;"1894266310";;;"";;"";"data/20-38-thickbox.jpg";"yes";"11645.00";0;"2009-02-03 16:06:50";"2012-02-27 06:55:31";"2009-02-03";;;;;;;"true";;;"1";;"<p>Настенная вытяжка шириной 90 см. Потребляемая мощность 200 Вт. Освещение – галогенные лампы, 2 х 20 Вт. Управление: механические кнопки. Угольный фильтр. Отделка: Stainless steel + Cherry, Stainless steel + wood.</p>";;;"Вытяжка Elica ONICE IX + NOCE F90";"Вытяжка Elica ONICE IX + NOCE F90";7;0;;;;0;"true";1
"4";"Микроволновая печь BORK W531";"1009";;"1308944572";;;"";;"";"data/4-6-thickbox.jpg";"yes";"14470.00";0;"2009-02-03 16:06:50";"2012-02-27 06:55:31";"2009-02-03";;;;;;;"true";;;"1";;"<p>Микроволновая печь с теновым грилем и конвекцией объемом 32 литра.</p><p>Электронное управление. 4 комбинированных режима.</p><p>Автоматическое приготовление и разогрев.</p><p>Программы разморозки по весу и времени.</p><p>Возможность приготовления на вертеле.</p><p>Режим последовательного приготовления.</p><p>Функция быстрого и отложенного старта.</p><p>Режим экспресс приготовления для работы при максимальной мощности за 30 секунд.</p><p>Блокировка от детей.</p><p>Внутреннее покрытие из нержавеющей стали.</p><p>Диаметр поворотного стола: 31.50 см.</p><p>LCD-дисплей.</p><p>Часы.</p>";;;"Микроволновая печь BORK W531";"Микроволновая печь BORK W531";7;0;;;;0;"true";1
"2";"Погружной блендер Philips HR1377";"1009";;"1080163006";;;"";;"";"data/2-3-thickbox.jpg";"yes";"21130.00";0;"2009-02-03 16:06:50";"2012-02-27 06:55:31";"2009-02-03";;;;;;;"true";;;"1";;"<p>Основные характеристики:</p><p>Тип погружной</p><p>Мощность 700 Вт</p><p>Управление механическое, число скоростей: 5, плавная регулировка скорости</p><p>Особенности:</p><p>Материал корпуса металл</p><p>Материал погружной части металл</p><p>Отверстие для ингредиентов есть</p><p>Сетевой шнур длина 1.30 м</p><p>Функциональные возможности:</p><p>Дополнительные режимы турборежим</p><p>Измельчитель есть, объем 1.5 л</p><p>Мерный стакан есть, объем 1 л</p><p>Венчик для взбивания есть</p><p>Дополнительная информация диск для нарезки тонкими/средними ломтиками; диск для шинковки/нарезки</p>";;;"Погружной блендер Philips HR1377";"Погружной блендер Philips HR1377";7;0;;;;0;"true";1
"29";"Манеж-кровать Capella C1";"1009";;"1848786829";;;"";;"";"data/29-67-thickbox.jpg";"yes";"23194.00";0;"2009-02-03 16:06:50";"2012-02-27 06:55:31";"2009-02-03";;;;;;;"true";;;"1";;"<p>Двухуровневый просторный манеж-кровать с пеленальным столиком. Вибромузыкальный блок успокоит ребенка и поможет ему заснуть. Быстрый и безопасный механизм складывания-раскладывания манежа. Колесные фиксаторы позволяют свободно передвигать манеж-кровать. Кольца-держатели, с помощью которых ребенок сможет подтянуться и встать на ножки. Боковой лаз на молнии. Центральная ножка манежа обеспечивает дополнительную устойчивость.</p>";;;"Манеж-кровать Capella C1";"Манеж-кровать Capella C1";7;0;;;;0;"true";1
"26";"Детская кроватка Красная Звезда Елизавета С-550";"1009";;"1416746442";;;"";;"";"data/26-58-thickbox.jpg";"yes";"11435.00";0;"2009-02-03 16:06:50";"2012-02-27 06:55:31";"2009-02-03";;;;;;;"true";;;"1";;"<p>Детская кроватка с ложем увеличенного размера 140х70см, превращается в красивый уютный диванчик. Вместительный ящик для детских принадлежностей. Две съёмные планки. Силиконовая накладка на боковине. 4 съемных колеса со стопорами. Материал - массив березы. Отсутствуют острые углы. Древесина обработана экологически чистым лаком. Размер кровати: 156х77х113 см.</p>";;;"Детская кроватка Красная Звезда Елизавета С-550";"Детская кроватка Красная Звезда Елизавета С-550";7;0;;;;0;"true";1
"37";"Стульчик для кормления Peg-Perego Tatamia";"1009";;"1926277703";;;"";;"";"data/37-82-thickbox.jpg";"yes";"12367.00";0;"2009-02-03 16:06:50";"2012-02-27 06:55:31";"2009-02-03";;;;;;;"true";;;"1";;"<p>Стульчик Tatamia от 0 до 36 месяцев. Двойной поднос в двойне гигиеничнее. Можно мыть в посудомоечной машине. Угол наклона стула регулируется, имеет 4 положения. Пятиточечные ремни безопасности. Имеет 9 положений сидения по высоте. Может использоваться как шезлонг или расслабляющее кресло-качалка. Цвета: Cacao, Fiordilatte, Paloma, Arancio.</p>";;;"Стульчик для кормления Peg-Perego Tatamia";"Стульчик для кормления Peg-Perego Tatamia";7;0;;;;0;"true";1
"48";"Директорское кресло VIP класса Status Extra";"1009";;"441212364";;;"";;"";"data/48-99-thickbox.jpg";"yes";"31200.00";0;"2009-02-03 16:06:50";"2012-02-27 06:55:31";"2009-02-03";;;;;;;"true";;;"1";;"<p>Директорское кресло VIP класса Status Extra для руководителя,дома и офиса. СТАТУС дерево натуральная кожа 100% люкс LE-16/K цвет бренди Кожаное кресло VIP класса для руководителя,дома и офиса. Широкое мягкое сиденье и высокая спинка с механизмом трансформации. Удобные мягкие кожаные подлокотники . Элегантная металическая крестовина с деревянными накладками,точенный из масива чехол пневмо-целиндра. Кресло комплектуется механизмом ТРАНСФОРМАЦИИ который обеспечивает разложение кресла практически в горизонтальное положение. Обивка кресла натуральная кожа высшего качества LUX 100%. выделки Extra - мягкая и эластичная.</p>";;;"Директорское кресло VIP класса Status Extra";"Директорское кресло VIP класса Status Extra";7;0;;;;0;"true";1
"25";"Коляска Hauck Condor";"1009";;"1827331686";;;"";;"";"data/25-56-thickbox.jpg";"yes";"24312.00";0;"2009-02-03 16:06:50";"2012-02-27 06:55:31";"2009-02-03";;;;;;;"true";;;"1";;"<p>Прогулочная коляска. Регулируемый наклон спинки. Регулируемая подножка. Солнцезащитный козырек со смотровым окошком. Пятиточечный ремень безопасности. Съемный поручень. Тканевые части коляски можно стирать. Дождевик. Вес 10 кг.</p>";;;"Коляска Hauck Condor";"Коляска Hauck Condor";7;0;;;;0;"true";1
"22";"Автокресло Maxi-Cosi Priori SPS";"1009";;"1700607309";;;"";;"";"data/22-46-thickbox.jpg";"yes";"36217.00";0;"2009-02-03 16:06:50";"2012-02-27 06:55:31";"2009-02-03";;;;;;;"true";;;"1";;"<p>Модель детского автокресла первой возрастной группы. Оно разработано для малышей, только начинающих ходить, и дошкольников (возраст от 9 месяцев до 4-х лет, вес 9-18 кг). Автокресло Priori легко устанавливается и закрепляется ремнями безопасности с креплением в 2-х или 3-х точках на любом пассажирском месте во всех типах автомобилей. Съемные чехлы можно стирать. Цвета: Bjorn, Enzo, Indigo, Prado, Solar, Stratos, Florian, Horizon, Roseline.</p>";;;"Автокресло Maxi-Cosi Priori SPS";"Автокресло Maxi-Cosi Priori SPS";7;0;;;;0;"true";1
"38";"Стульчик для кормления Cam Smarty S332-C27";"1009";;"1920692345";;;"";;"";"data/38-86-thickbox.jpg";"yes";"11175.00";0;"2009-02-03 16:06:50";"2012-02-27 06:55:31";"2009-02-03";;;;;;;"true";;;"1";;"<p>Универсальный стульчик для детей от 6 до 48 месяцев. Крепится к сиденью или спинке обычного стула при помощи ремней. Регулируется по высоте от 0 до 18 см. Съемный столик. Легко транспортируется. Моется при помощи губки. Пятиточечные ремни безопасности.</p>";;;"Стульчик для кормления Cam Smarty S332-C27";"Стульчик для кормления Cam Smarty S332-C27";7;0;;;;0;"true";1
"52";"Мотобур STIHL BT 360";"1009";;"490371367";;;"";;"";"data/52-104-thickbox.jpg";"yes";"11700.00";0;"2009-02-03 16:06:50";"2012-02-27 06:55:31";"2009-02-03";;;;;;;"true";;;"1";;"<p>Мощный мотобур, обслуживаемый двумя рабочими, мощностью 3 кВт, со складной рамой для переноски. Предназначается для выполнения разнообразных задач от бурения простых скважин в земле, до взятия образцов почвы.</p>";;;"Мотобур STIHL BT 360";"Мотобур STIHL BT 360";7;0;;;;0;"true";1
"55";"Гайковерт Bosch GDS 12 V";"1009";;"945153030";;;"";;"";"data/55-107-thickbox.jpg";"yes";"13420.00";0;"2009-02-03 16:06:50";"2012-02-27 06:55:31";"2009-02-03";;;;;;;"true";;;"1";;"<p>Аккумуляторный ударный гайковерт, высокий крутящий момент и сила удара, компактная и эргономичная форма, встроенная подсветка с 3 светодиодами для освещения рабочей зоны, металлический корпус редуктора для высочайшей точности и долгого срока службы, 2 аккумулятора NiMH емкостью 2,6 Ач, зажим для переноски на ремне, петля на руку, реверс, безопасная работа без обратного удара, управляющая электроника, рукоятка с мягкой накладкой.</p>";;;"Гайковерт Bosch GDS 12 V";"Гайковерт Bosch GDS 12 V";7;0;;;;0;"true";1
"57";"Компрессор Remeza СБ4С270.АВ670";"1009";;"807438575";;;"";;"";"data/57-109-thickbox.jpg";"yes";"251580.00";0;"2009-02-03 16:06:50";"2012-02-27 06:55:31";"2009-02-03";;;;;;;"true";;;"1";;"<p>Используется в бытовых целях и промышленных условиях как источник сжатого воздуха для пневмоинструмента, окрасочных работ, автосервиса и т. д.</p>";;;"Компрессор Remeza СБ4С270.АВ670";"Компрессор Remeza СБ4С270.АВ670";7;0;;;;0;"true";1
"82";"Радиотелефон Dect Panasonic KX-TCD815";"1009";;"2109182114";;;"";;"";"data/82-145-thickbox.jpg";"yes";"32120.00";0;"2009-02-03 16:06:50";"2012-02-27 06:55:31";"2009-02-03";;;;;;;"true";;;"1";;"<p>Радиотелефон стандарта DECT/GAP. Загрузка картинок и мелодий с ПК или мобильного телефона (встроенный ИК-порт, в комплекте кабель USB). Автоматический определитель номера: АОН, Caller ID (журнал на 50 вызовов). Проговаривание голосом номера. Большой графический цветной дисплей - 65000 цветов. 6 обычных + 14 полифонических мелодий звонка. Загрузка мелодий с любого аудио-устройства через кабель. Меню и телефонный справочник на русском языке (200 номеров). Возможность присваивания до 3-х номеров телефонов и картинки для одной записи. Редактирование записей с помощью ПК. Функция Нянька. Спикерфон (громкая связь) на трубке. Дата, часы, будильник. Повторный набор последних 5-ти набранных номеров. Подключение гарнитуры. Ночной режим. Кнопка Flash для переадресация на мини-АТС. Подключение до 6-ти трубок на одну базу. Подключение одной трубки на 4 базы. Конференц-связь. Внутренняя связь между трубками. Переадресация внешнего звонка между трубками. Подключение к видеодомофонной системе.</p>";;;"Радиотелефон Dect Panasonic KX-TCD815";"Радиотелефон Dect Panasonic KX-TCD815";7;0;;;;0;"true";1
"89";"Факсимильный аппарат Panasonic KX-FC258RU";"1009";;"1667014103";;;"";;"";"data/89-154-thickbox.jpg";"yes";"42265.00";0;"2009-02-03 16:06:50";"2012-02-27 06:55:31";"2009-02-03";;;;;;;"true";;;"1";;"<p>Двухстрочный дисплей. Беспроводная DECT трубка с цветным дисплеем. Печать по принципу термопереноса. Цифровой дуплексный спикерфон. Цифровой автоответчик. Время записи - 15 минут. Скорость модема - до 9,6 Кбит/с. Кнопка навигации. Автоподатчик на 10 листов. Лоток на 20 листов. Отложенная передача. Прием при отсутствии бумаги (до 28 страниц). Набор 100 номеров из памяти. Функция копирования с возможностью масштабирования.</p>";;;"Факсимильный аппарат Panasonic KX-FC258RU";"Факсимильный аппарат Panasonic KX-FC258RU";7;0;;;;0;"true";1
"91";"Коммуникатор ASUS MyPal A639";"1009";;"1542096497";;;"";;"";"data/91-156-thickbox.jpg";"yes";"24530.00";0;"2009-02-03 16:06:50";"2012-02-27 06:55:31";"2009-02-03";;;;;;;"true";;;"1";;"<p>Операционная система Windows Mobile 5.0 for Pocket PC. Процессор Intel XScale PXA270 416 МГц. Оперативная память 64 Мб, Flash-память ROM 1 Гб. Интерфейсы: SD/MMC с поддержкой SDIO, IrDA, Bluetooth 2.0+EDR, Wi-Fi (IEEE802.11b/g), USB 1.1 клиент (синхронизация, заряд, кард-ридер). Встроенный GPS-приемник SiRF Star III, внешняя поворотная антенна, разъем для подключения дополнительной антенны. Экран 3.5” c разрешением 240х320 точек, 64 тысячи цветов.</p>";;;"Коммуникатор ASUS MyPal A639";"Коммуникатор ASUS MyPal A639";7;0;;;;0;"true";1
