"Артикул ";"Наименование ";"Цена";"На складе ";"Описание ";"Краткое описание ";"Заголовок страницы ";"Тэг META keywords ";"Тэг META description ";"Фотография ";"Фотография ";"Фотография ";"Фотография ";"Фотография ";"Фотография ";"Фотография ";"Фотография ";"Фотография ";"Фотография ";"Производитель"
"1009_29";"Манеж-кровать Capella C1";"23194.00";100;"<p>Двухуровневый просторный манеж-кровать с пеленальным столиком. Вибромузыкальный блок успокоит ребенка и поможет ему заснуть. Быстрый и безопасный механизм складывания-раскладывания манежа. Колесные фиксаторы позволяют свободно передвигать манеж-кровать. Кольца-держатели, с помощью которых ребенок сможет подтянуться и встать на ножки. Боковой лаз на молнии. Центральная ножка манежа обеспечивает дополнительную устойчивость.</p>";"<p>Двухуровневый просторный манеж-кровать с пеленальным столиком. Вибромузыкальный блок успокоит ребенка и поможет ему заснуть. Быстрый и безопасный механизм складывания-раскладывания манежа. Колесные фиксаторы позволяют свободно передвигать манеж-кровать.</p>";"Манеж-кровать Capella C1";"";"";"29-67-thickbox_small.jpg,29-67-thickbox_medium.jpg,29-67-thickbox.jpg";"29-68-thickbox_small.jpg,29-68-thickbox_medium.jpg,29-68-thickbox.jpg";"29-69-thickbox_small.jpg,29-69-thickbox_medium.jpg,29-69-thickbox.jpg";"";"";"";"";"";"";"";""
"1009_26";"Детская кроватка Красная Звезда Елизавета С-550";"11435.00";100;"<p>Детская кроватка с ложем увеличенного размера 140х70см, превращается в красивый уютный диванчик. Вместительный ящик для детских принадлежностей. Две съёмные планки. Силиконовая накладка на боковине. 4 съемных колеса со стопорами. Материал - массив березы. Отсутствуют острые углы. Древесина обработана экологически чистым лаком. Размер кровати: 156х77х113 см.</p>";"<p>Детская кроватка с ложем увеличенного размера 140х70см, превращается в красивый уютный диванчик.</p>";"Детская кроватка Красная Звезда Елизавета С-550";"";"";"26-58-thickbox_small.jpg,26-58-thickbox_medium.jpg,26-58-thickbox.jpg";"";"";"";"";"";"";"";"";"";""
"1009_37";"Стульчик для кормления Peg-Perego Tatamia";"12367.00";100;"<p>Стульчик Tatamia от 0 до 36 месяцев. Двойной поднос в двойне гигиеничнее. Можно мыть в посудомоечной машине. Угол наклона стула регулируется, имеет 4 положения. Пятиточечные ремни безопасности. Имеет 9 положений сидения по высоте. Может использоваться как шезлонг или расслабляющее кресло-качалка. Цвета: Cacao, Fiordilatte, Paloma, Arancio.</p>";"<p>Стульчик Tatamia от 0 до 36 месяцев. Двойной поднос в двойне гигиеничнее. Можно мыть в посудомоечной машине. Угол наклона стула регулируется, имеет 4 положения.</p>";"Стульчик для кормления Peg-Perego Tatamia";"";"";"37-82-thickbox_small.jpg,37-82-thickbox_medium.jpg,37-82-thickbox.jpg";"37-83-thickbox_small.jpg,37-83-thickbox_medium.jpg,37-83-thickbox.jpg";"37-84-thickbox_small.jpg,37-84-thickbox_medium.jpg,37-84-thickbox.jpg";"37-85-thickbox_small.jpg,37-85-thickbox_medium.jpg,37-85-thickbox.jpg";"";"";"";"";"";"";""
"1009_48";"Директорское кресло VIP класса Status Extra";"31200.00";100;"<p>Директорское кресло VIP класса Status Extra для руководителя,дома и офиса. СТАТУС дерево натуральная кожа 100% люкс LE-16/K цвет бренди Кожаное кресло VIP класса для руководителя,дома и офиса. Широкое мягкое сиденье и высокая спинка с механизмом трансформации. Удобные мягкие кожаные подлокотники . Элегантная металическая крестовина с деревянными накладками,точенный из масива чехол пневмо-целиндра. Кресло комплектуется механизмом ТРАНСФОРМАЦИИ который обеспечивает разложение кресла практически в горизонтальное положение. Обивка кресла натуральная кожа высшего качества LUX 100%. выделки Extra - мягкая и эластичная.</p>";"<p>Директорское кресло VIP класса Status Extra для руководителя,дома и офиса. СТАТУС дерево натуральная кожа 100% люкс LE-16/K цвет бренди Кожаное кресло VIP класса для руководителя,дома и офиса.</p>";"Директорское кресло VIP класса Status Extra";"";"";"48-99-thickbox_small.jpg,48-99-thickbox_medium.jpg,48-99-thickbox.jpg";"48-100-thickbox_small.jpg,48-100-thickbox_medium.jpg,48-100-thickbox.jpg";"";"";"";"";"";"";"";"";""
"1009_25";"Коляска Hauck Condor";"24312.00";100;"<p>Прогулочная коляска. Регулируемый наклон спинки. Регулируемая подножка. Солнцезащитный козырек со смотровым окошком. Пятиточечный ремень безопасности. Съемный поручень. Тканевые части коляски можно стирать. Дождевик. Вес 10 кг.</p>";"<p>Прогулочная коляска. Регулируемый наклон спинки. Регулируемая подножка. Солнцезащитный козырек со смотровым окошком.</p>";"Коляска Hauck Condor";"";"";"25-56-thickbox_small.jpg,25-56-thickbox_medium.jpg,25-56-thickbox.jpg";"25-57-thickbox_small.jpg,25-57-thickbox_medium.jpg,25-57-thickbox.jpg";"";"";"";"";"";"";"";"";""
"1009_22";"Автокресло Maxi-Cosi Priori SPS";"36217.00";100;"<p>Модель детского автокресла первой возрастной группы. Оно разработано для малышей, только начинающих ходить, и дошкольников (возраст от 9 месяцев до 4-х лет, вес 9-18 кг). Автокресло Priori легко устанавливается и закрепляется ремнями безопасности с креплением в 2-х или 3-х точках на любом пассажирском месте во всех типах автомобилей. Съемные чехлы можно стирать. Цвета: Bjorn, Enzo, Indigo, Prado, Solar, Stratos, Florian, Horizon, Roseline.</p>";"<p>Модель детского автокресла первой возрастной группы. Оно разработано для малышей, только начинающих ходить, и дошкольников (возраст от 9 месяцев до 4-х лет, вес 9-18 кг).</p>";"Автокресло Maxi-Cosi Priori SPS";"";"";"22-46-thickbox_small.jpg,22-46-thickbox_medium.jpg,22-46-thickbox.jpg";"";"";"";"";"";"";"";"";"";""
"1009_38";"Стульчик для кормления Cam Smarty S332-C27";"11175.00";100;"<p>Универсальный стульчик для детей от 6 до 48 месяцев. Крепится к сиденью или спинке обычного стула при помощи ремней. Регулируется по высоте от 0 до 18 см. Съемный столик. Легко транспортируется. Моется при помощи губки. Пятиточечные ремни безопасности.</p>";"<p>Универсальный стульчик для детей от 6 до 48 месяцев. Крепится к сиденью или спинке обычного стула при помощи ремней. Регулируется по высоте от 0 до 18 см. Съемный столик. Легко транспортируется. Моется при помощи губки. Пятиточечные ремни безопасности.</p>";"Стульчик для кормления Cam Smarty S332-C27";"";"";"38-86-thickbox_small.jpg,38-86-thickbox_medium.jpg,38-86-thickbox.jpg";"";"";"";"";"";"";"";"";"";""
"1009_52";"Мотобур STIHL BT 360";"11700.00";100;"<p>Мощный мотобур, обслуживаемый двумя рабочими, мощностью 3 кВт, со складной рамой для переноски. Предназначается для выполнения разнообразных задач от бурения простых скважин в земле, до взятия образцов почвы.</p>";"<p>Мощный мотобур, обслуживаемый двумя рабочими, мощностью 3 кВт, со складной рамой для переноски. Предназначается для выполнения разнообразных задач от бурения простых скважин в земле, до взятия образцов почвы.</p>";"Мотобур STIHL BT 360";"";"";"52-104-thickbox_small.jpg,52-104-thickbox_medium.jpg,52-104-thickbox.jpg";"";"";"";"";"";"";"";"";"";""
"1009_55";"Гайковерт Bosch GDS 12 V";"13420.00";100;"<p>Аккумуляторный ударный гайковерт, высокий крутящий момент и сила удара, компактная и эргономичная форма, встроенная подсветка с 3 светодиодами для освещения рабочей зоны, металлический корпус редуктора для высочайшей точности и долгого срока службы, 2 аккумулятора NiMH емкостью 2,6 Ач, зажим для переноски на ремне, петля на руку, реверс, безопасная работа без обратного удара, управляющая электроника, рукоятка с мягкой накладкой.</p>";"<p>Аккумуляторный ударный гайковерт, высокий крутящий момент и сила удара</p>";"Гайковерт Bosch GDS 12 V";"";"";"55-107-thickbox_small.jpg,55-107-thickbox_medium.jpg,55-107-thickbox.jpg";"";"";"";"";"";"";"";"";"";""
"1009_57";"Компрессор Remeza СБ4С270.АВ670";"251580.00";100;"<p>Используется в бытовых целях и промышленных условиях как источник сжатого воздуха для пневмоинструмента, окрасочных работ, автосервиса и т. д.</p>";"<p>Используется в бытовых целях и промышленных условиях как источник сжатого воздуха для пневмоинструмента, окрасочных работ, автосервиса и т. д.</p>";"Компрессор Remeza СБ4С270.АВ670";"";"";"57-109-thickbox_small.jpg,57-109-thickbox_medium.jpg,57-109-thickbox.jpg";"";"";"";"";"";"";"";"";"";""
"1009_82";"Радиотелефон Dect Panasonic KX-TCD815";"32120.00";100;"<p>Радиотелефон стандарта DECT/GAP. Загрузка картинок и мелодий с ПК или мобильного телефона (встроенный ИК-порт, в комплекте кабель USB). Автоматический определитель номера: АОН, Caller ID (журнал на 50 вызовов). Проговаривание голосом номера. Большой графический цветной дисплей - 65000 цветов. 6 обычных + 14 полифонических мелодий звонка. Загрузка мелодий с любого аудио-устройства через кабель. Меню и телефонный справочник на русском языке (200 номеров). Возможность присваивания до 3-х номеров телефонов и картинки для одной записи. Редактирование записей с помощью ПК. Функция Нянька. Спикерфон (громкая связь) на трубке. Дата, часы, будильник. Повторный набор последних 5-ти набранных номеров. Подключение гарнитуры. Ночной режим. Кнопка Flash для переадресация на мини-АТС. Подключение до 6-ти трубок на одну базу. Подключение одной трубки на 4 базы. Конференц-связь. Внутренняя связь между трубками. Переадресация внешнего звонка между трубками. Подключение к видеодомофонной системе.</p>";"<p>Радиотелефон стандарта DECT/GAP. Загрузка картинок и мелодий с ПК или мобильного телефона (встроенный ИК-порт, в комплекте кабель USB).</p>";"Радиотелефон Dect Panasonic KX-TCD815";"";"";"82-145-thickbox_small.jpg,82-145-thickbox_medium.jpg,82-145-thickbox.jpg";"82-146-thickbox_small.jpg,82-146-thickbox_medium.jpg,82-146-thickbox.jpg";"";"";"";"";"";"";"";"";""
"1009_89";"Факсимильный аппарат Panasonic KX-FC258RU";"42265.00";100;"<p>Двухстрочный дисплей. Беспроводная DECT трубка с цветным дисплеем. Печать по принципу термопереноса. Цифровой дуплексный спикерфон. Цифровой автоответчик. Время записи - 15 минут. Скорость модема - до 9,6 Кбит/с. Кнопка навигации. Автоподатчик на 10 листов. Лоток на 20 листов. Отложенная передача. Прием при отсутствии бумаги (до 28 страниц). Набор 100 номеров из памяти. Функция копирования с возможностью масштабирования.</p>";"<p>Двухстрочный дисплей. Беспроводная DECT трубка с цветным дисплеем. Печать по принципу термопереноса.</p>";"Факсимильный аппарат Panasonic KX-FC258RU";"";"";"89-154-thickbox_small.jpg,89-154-thickbox_medium.jpg,89-154-thickbox.jpg";"";"";"";"";"";"";"";"";"";""
"1009_91";"Коммуникатор ASUS MyPal A639";"24530.00";100;"<p>Операционная система Windows Mobile 5.0 for Pocket PC. Процессор Intel XScale PXA270 416 МГц. Оперативная память 64 Мб, Flash-память ROM 1 Гб. Интерфейсы: SD/MMC с поддержкой SDIO, IrDA, Bluetooth 2.0+EDR, Wi-Fi (IEEE802.11b/g), USB 1.1 клиент (синхронизация, заряд, кард-ридер). Встроенный GPS-приемник SiRF Star III, внешняя поворотная антенна, разъем для подключения дополнительной антенны. Экран 3.5” c разрешением 240х320 точек, 64 тысячи цветов.</p>";"<p>Операционная система Windows Mobile 5.0 for Pocket PC. Процессор Intel XScale PXA270 416 МГц. Оперативная память 64 Мб, Flash-память ROM 1 Гб. Интерфейсы: SD/MMC с поддержкой SDIO, IrDA, Bluetooth 2.0+EDR, Wi-Fi (IEEE802.11b/g), USB 1.1 клиент (синхронизация, заряд, кард-ридер).</p>";"Коммуникатор ASUS MyPal A639";"";"";"91-156-thickbox_small.jpg,91-156-thickbox_medium.jpg,91-156-thickbox.jpg";"91-157-thickbox_small.jpg,91-157-thickbox_medium.jpg,91-157-thickbox.jpg";"91-158-thickbox_small.jpg,91-158-thickbox_medium.jpg,91-158-thickbox.jpg";"91-159-thickbox_small.jpg,91-159-thickbox_medium.jpg,91-159-thickbox.jpg";"91-160-thickbox_small.jpg,91-160-thickbox_medium.jpg,91-160-thickbox.jpg";"";"";"";"";"";""
0;;Нецелые цены;;;;;;;;;;;;;;;;
"1010_5";"Миксер Philips HR1565";"90.90";100;"<p>Легкое приготовление домашних дессертов Миксер с поворачивающейся чашей Приготовление изысканных домашних тортов, пирогов и выпечки для всей семьи еще никогда не было настолько простым. Этот 350 Вт миксер Philips с подставкой и чашей сделает за вас всю трудную работу, за минуты приготовив идеальные смеси. Ваш верный и надежный помощник на кухне.</p><p>Свободные руки при смешивании Вращающаяся чаша емкостью 3 л Подставка миксера</p><p>Идеальное тесто и десерты за несколько минут Мощный (350 Ватт) мотор Различные скоростные режимы и турборежим</p><p>Идеально взбивает и смешивает Насадки для взбивания и для теста в комплекте</p><p>Быстрая и простая чистка Удобная лопаточка</p><p>Удобство хранения Зажим для шнура</p><p>Общие характеристики Режимы скоростей: 3 Кнопка включения турборежима Зажим для шнура</p><p>Технические характеристики Мощность: 350 Вт Напряжение: 230-240 В Частота: 50/60 Гц Длина шнура: 1,50 м</p><p>Характеристики дизайна Материал, из которого изготовлен корпус: ABS Материал насадок для взбивания/для теста: Из нержавеющей стали</p><p>Принадлежности Насадки для взбивания Насадки для теста</p><p>Дата выпуска 2008-05-21</p>";"<p>Легкое приготовление домашних дессертов Миксер с поворачивающейся чашей Приготовление изысканных домашних тортов, пирогов и выпечки для всей семьи еще никогда не было настолько простым. Этот 350 Вт миксер Philips с подставкой и чашей сделает за вас всю трудную работу, за минуты приготовив идеальные смеси. Ваш верный и надежный помощник на кухне.</p>";"Миксер Philips HR1565";"";"";"5-12-thickbox_small.jpg,5-12-thickbox_medium.jpg,5-12-thickbox.jpg";"";"";"";"";"";"";"";"";"";""
"1010_7";"Универсальная соковыжималка Philips HR186630";"180.80";100;"<p>Тип универсальная</p><p>Мощность 800 Вт</p><p>Резервуар для сока стакан, объем 1.25 л</p><p>Система прямой подачи сока есть</p><p>Система капля-стоп есть</p><p>Сбор мякоти автоматический выброс мякоти, объем резервуара 2 л</p><p>Сепаратор для пены есть</p><p>Защитные функции защита от случайного включения</p><p>Технические характеристики</p><p>Тип универсальная</p><p>Мощность 800 Вт</p><p>Резервуар для сока стакан, объем 1.25 л</p><p>Система прямой подачи сока есть</p><p>Система капля-стоп есть</p><p>Сбор мякоти автоматический выброс мякоти, объем резервуара 2 л</p><p>Сепаратор для пены есть</p><p>Защитные функции защита от случайного включения</p><p>Особенности</p><p>Материал корпуса алюминий</p><p>Материал сетки центрифуги нерж. сталь</p><p>Круглая горловина есть</p><p>Размер горловины 74 мм</p><p>Комплектация щеточка для чистки</p><p>Прорезиненные ножки есть</p><p>Отсек для сетевого шнура длина 1.2 м</p><p>Управление</p><p>Количество скоростей 2</p>";"<p>Тип универсальная</p><p>Мощность 800 Вт</p><p>Резервуар для сока стакан, объем 1.25 л</p><p>Система прямой подачи сока есть</p><p>Система капля-стоп есть</p><p>Сбор мякоти автоматический выброс мякоти, объем резервуара 2 л</p><p>Сепаратор для пены есть</p><p>Защитные функции защита от случайного включения</p>";"Универсальная соковыжималка Philips HR186630";"";"";"7-14-thickbox_small.jpg,7-14-thickbox_medium.jpg,7-14-thickbox.jpg";"7-15-thickbox_small.jpg,7-15-thickbox_medium.jpg,7-15-thickbox.jpg";"7-16-thickbox_small.jpg,7-16-thickbox_medium.jpg,7-16-thickbox.jpg";"7-17-thickbox_small.jpg,7-17-thickbox_medium.jpg,7-17-thickbox.jpg";"";"";"";"";"";"";""
"1010_11";"Чаеварка-чайник BOSCH TTA 2009";"80.70";100;"<p>Цвет: бежевый/серый, серебристый</p><p>Мощность: 1785 Вт макс.</p><p>Объем заварника: 0,7 л</p><p>Объем чайника: 2,0 л</p><p>Чайник из полупрозрачного пластика со шкалой уровня воды</p><p>Стеклянный заварник с крышкой</p><p>Ситечко для заварки из нержавеющей стали</p><p>Круговой светоиндикатор «Улыбка»</p><p>Крышка для чайника в комплекте</p><p>Скрытый нагревательный элемент, дно из нержавеющей стали</p><p>Автоматическое переключение на режим подогрева</p><p>Цоколь с центральным контактом позволяет устанавливать чайник в любом положении</p><p>Клавиша переключения режимов кипячения и нагрева</p><p>Клавиша «включения/отключения» прибора</p><p>Намотка кабеля в цоколе</p>";"<p>Цвет: бежевый/серый, серебристый</p><p>Мощность: 1785 Вт макс.</p><p>Объем заварника: 0,7 л</p><p>Объем чайника: 2,0 л</p>";"Чаеварка-чайник BOSCH TTA 2009";"";"";"11-23-thickbox_small.jpg,11-23-thickbox_medium.jpg,11-23-thickbox.jpg";"11-24-thickbox_small.jpg,11-24-thickbox_medium.jpg,11-24-thickbox.jpg";"";"";"";"";"";"";"";"";""
