"cat";"num";"act ";"name";"prc";"brd";"shdesc";"desc";"mimg";"simg";"modim";"modis"
"Очень большая";"42";1;"Печь для бани Термофор Калина";"1230.00";"";"<p>Дровяная печь-камин премиум-класса. Большой светопрозрачный экран, расширяющийся топливный канал и широкий топливник позволяют комфортно обозревать пламя под разными углами зрения.</p>";"<p>Дровяная печь-камин премиум-класса. Большой светопрозрачный экран, расширяющийся топливный канал и широкий топливник позволяют комфортно обозревать пламя под разными углами зрения. Оригинальный лабиринтный газоход обеспечивает мощный скоростной нагрев парилки объемом до 24 кубических метров и качественный прогрев каменной закладки массой около 100 килограммов. Встроенный теплообменник позволяет нагревать воду в выносном баке, размещенном в смежном помещении.</p>";"42-93-thickbox.jpg";"42-93-thickbox.jpg";"42-93-thickbox.jpg";"42-93-thickbox.jpg"
"Очень большая";"49";1;"Шезлонг Canadian Camper 68014";"190.00";"";"<p>СС-68014 - одно из самых лучших кресел для отдыха за городом на лоне природы.</p><p>Регулируемые по высоте подушка-подголовник кресла и патентованная система наклона спинки, позволит подобрать наиболее удобное для вас положение.</p>";"<p>СС-68014 - одно из самых лучших кресел для отдыха за городом на лоне природы.</p><p>Регулируемые по высоте подушка-подголовник кресла и патентованная система наклона спинки, позволит подобрать наиболее удобное для вас положение.</p><p>Сетчатая структура стойкого к ультрафиолетовому излучению материал кресла – HD TEXTILENE - обеспечит максимальный комфорт даже в летнюю жару. Также этот материал почти не впитывает влагу и моментально сохнет.</p><p>Пластмас, из которого сделаны подлокотники кресла, не только придает «шарм» креслу, но и обеспечивает приятные тактильные ощущения. Прочный стальной каркас кресла выдерживает нагрузку до 120 кг.</p><p>Меняется положение при помощи тела человека , в подлокотниках есть два фиксатора для наиболее удобного принятия положения.</p><p>Транспортировочное положение , положение для хранения , минимум занимаемой площади</p>";"49-101-thickbox.jpg";"49-101-thickbox.jpg";"49-101-thickbox.jpg";"49-101-thickbox.jpg"
"Очень большая";"47";1;"Светильник на зеркало K-26 MARTA тюльпан";"26.00";"";"<p>Цвет: хром 230V E14 Max 40WТорговая марка: MARTA Производство: Польша</p>";"<p>Цвет: хром 230V E14 Max 40WТорговая марка: MARTA Производство: Польша</p>";"47-98-thickbox.jpg";"47-98-thickbox.jpg";"47-98-thickbox.jpg";"47-98-thickbox.jpg"
"Очень большая";"53";1;"Бетономешалка Power Tec BWE180/140";"320.00";"";"<p>Бетономешалка с загрузкой и выгрузкой с обеих сторон. Выгрузка на высоте тележки. Ёмкость барабана: 180 л. Рабочая ёмкость: 140 л. Производительность: 1,1 м3/ч. Мощность двигателя: 0,55-0,75 кВт. Вес: 73 кг.</p>";"<p>Бетономешалка с загрузкой и выгрузкой с обеих сторон. Выгрузка на высоте тележки. Ёмкость барабана: 180 л. Рабочая ёмкость: 140 л. Производительность: 1,1 м3/ч. Мощность двигателя: 0,55-0,75 кВт. Вес: 73 кг.</p>";"53-105-thickbox.jpg";"53-105-thickbox.jpg";"53-105-thickbox.jpg";"53-105-thickbox.jpg"
"Очень большая";"65";1;"Пылесос промышленный FA-SA DOMINO 78 inox";"785.00";"";"<p>2 тихих двухстадийных двигателя (Domino), металлические профессиональные закрывающие замки</p>";"<p>2 тихих двухстадийных двигателя (Domino), металлические профессиональные закрывающие замки, поплавковый клапан, полностью снимаемая верхняя часть, защита от статического электричества, силовой кабель 7 м, легко снимается основа (во время очистки фильтра), всасывающая система с байпасным охлаждением, ударопрочная тележка устойчивая к воздействию химикатов и высоких температур.</p>";"65-116-thickbox.jpg";"65-116-thickbox.jpg";"65-116-thickbox.jpg";"65-116-thickbox.jpg"
"Очень большая";"62";1;"Бензорез Stihl TS 700";"1800.00";"";"<p>Ручной бензорез для пиления металла, бетона и асфальта.</p>";"<p>Ручной бензорез для пиления металла, бетона и асфальта. Мощность: 5 кВт. Трехступенчатая фильтрующая система. Система ElastoStart+ и антивибрационная система. Полуавтоматическое натяжение ремня.</p>";"62-113-thickbox.jpg";"62-113-thickbox.jpg";"62-113-thickbox.jpg";"62-113-thickbox.jpg"
"Очень большая";"60";1;"Сварочный генератор EUROPOWER EP-200X2";"2469.00";"";"<p>Сварочный генератор производится на базе четырехтактного бензинового двигателя с воздушным охлаждением HONDA GX390.</p>";"<p>Сварочный генератор производится на базе четырехтактного бензинового двигателя с воздушным охлаждением HONDA GX390. Предназначен для использования в качестве автономного источника питания и для ручной дуговой сварки постоянным током. Возможность работы в двух режимах - сварочного аппарата и электростанции. Максимальный сварочный ток: 200 A. Номинальный сварочный ток: 140 A. Мощность однофазного (230В) тока, кВт: 4. Диаметр электрода: до 4 мм (включительно). Расход: 2.7 л/ч. Объем бака: 6.5 л. Стартер: ручной. Уровень шума: 74 дБ.</p>";"60-111-thickbox.jpg";"60-111-thickbox.jpg";"60-111-thickbox.jpg";"60-111-thickbox.jpg"
"Очень большая";"63";1;"Ручная циркулярная пила Metabo KS 54";"190.00";"";"<p>Поворотный штуцер для подсоединения к внешней системе отсоса опилок. Корпус механизма привода, выполненный из алюминия методом литья под давлением.</p>";"<p>Поворотный штуцер для подсоединения к внешней системе отсоса опилок. Корпус механизма привода, выполненный из алюминия методом литья под давлением. Механизм изменения угла наклона пропила в пределах 0 - 45 градусов. Механический тормоз, защита от перегрузки. Новый тип более быстроходных тонких пильных дисков, хорошо видна линия резания, эргономический дизайн.</p>";"63-114-thickbox.jpg";"63-114-thickbox.jpg";"63-114-thickbox.jpg";"63-114-thickbox.jpg"
"Очень большая";"58";1;"Маятниковый лобзик с электроникой Metabo STEB 135";"300.00";"";"<p>Энергичный распил в деревянной заготовке толщиной до 135 мм.</p>";"<p>Энергичный распил в деревянной заготовке толщиной до 135 мм. Легкая и быстрая замена пильного диска, низко расположенный опорный ролик пильного полотна, быстрая фиксация направляющей панели для наклонного распила. Оптимальное удобство обращения благодаря эргономичному дизайну, прорезиненная рукоятка-скоба, устройство воздуходува, обеспечивающее просматриваемость области резания.</p>";"58-110-thickbox.jpg";"58-110-thickbox.jpg";"58-110-thickbox.jpg";"58-110-thickbox.jpg"
"Очень большая";"54";1;"Виброплита Сплитстоун VS-244";"2000.00";"";"<p>Виброплита предназначена для уплотнения асфальтобетонной смеси, грунта, щебня, песка.</p>";"<p>Виброплита предназначена для уплотнения асфальтобетонной смеси, грунта, щебня, песка. Идеальна при ремонте дорог, благоустройстве территории, устройстве фундаментов и инженерных сетей. Производительность виброплиты, м2/час 140. Эксплуатационная масса: 90 кг.</p>";"54-106-thickbox.jpg";"54-106-thickbox.jpg";"54-106-thickbox.jpg";"54-106-thickbox.jpg"
"Очень большая";"77";1;"Автомобильная громкая связь NEON BTHF009Dsp";"30.00";"";"<p>Комплект беспроводной громкой связи NEON поддерживает функции Определитель номера, Голосовой набор, Повторный набор последнего номера, Отложенный звонок  и Переключение вызова.</p>";"<p>Комплект беспроводной громкой связи NEON поддерживает функции Определитель номера, Голосовой набор, Повторный набор последнего номера, Отложенный звонок  и Переключение вызова. Переключение между функциями осуществляется при помощи многофункциональной клавиши, размещенной на лицевой панели. Версия BLUETOOTH: 2.0. Поддержка профилей: Наушники и Handsfree. Рабочее расстояние: 10 м (класс 2). Экран LCD отображает номер звонящего из 12 цифр. Шумоподавления и устранение эха.</p>";"77-137-thickbox.jpg";"77-137-thickbox.jpg";"77-137-thickbox.jpg";"77-137-thickbox.jpg"
"Очень большая";"81";1;"Радиотелефон DECT Siemens Gigaset S675";"203.00";"";"<p>Телефон с цветным дисплеем и 15 полифоническими мелодиями.</p>";"<p>Телефон с цветным дисплеем и 15 полифоническими мелодиями. Конференц-связь, автодозвон, автоответчик на 40 минут с дистанционным управлением с другого телефона, блокировка клавиатуры, идентификатор на 30 номеров, ответ поднятием трубки с базы, разъём для гарнитуры, уведомление о пропущенных вызовах с помощью SMS, экономичный режим, SMS. Стандарты DECT/GAP. Радиус действия в помещении до 50 метров, на открытой местности до 300. Возможно подключение до 6 трубок к одной базе и 4 баз к одной трубке.</p>";"81-144-thickbox.jpg";"81-144-thickbox.jpg";"81-144-thickbox.jpg";"81-144-thickbox.jpg"
"Очень большая";"86";1;"Проводной телефон TeXet TX-223 Кабинет";"130.00";"";"<p>Исполнение корпуса из натурального дерева. Регулировка уровня громкости вызывного акустического сигнала.</p>";"<p>Исполнение корпуса из натурального дерева. Регулировка уровня громкости вызывного акустического сигнала.</p>";"86-151-thickbox.jpg";"86-151-thickbox.jpg";"86-151-thickbox.jpg";"86-151-thickbox.jpg"
"Очень большая";"73";1;"Мобильный телефон LG KG810";"260.00";"";"<p>Качественный материал корпуса, выбор черного цвета, сдержанность, знающая себе цену.</p>";"<p>Качественный материал корпуса, выбор черного цвета, сдержанность, знающая себе цену. Этот имиджевый аксессуар обладает достаточной мультимедийной мощью. Сенсорные клавиши. TFT дисплей, отображающий 262000 цветов. 64-х голосная полифония. Встроенная 1.3 мегапиксельная камера. Прием и отправка SMS, EMS, MMS, E-mail. МР3/AAC/MP4 плеер. FM-радио. Bluetooth.</p>";"73-130-thickbox.jpg";"73-130-thickbox.jpg";"73-130-thickbox.jpg";"73-130-thickbox.jpg"
"Очень большая";"84";1;"Цифровой системный телефон LG-Nortel LDP-7016D";"175.00";"";"<p>Системный телефон с 16 программируемыми клавишами со световой индикацией. Трехстрочный информационный дисплей. 3 контекстные клавиши. Клавиши быстрой навигации. Спикерфон (громкая связь). Поддержка дочерних модулей. Световой индикатор вызова./p></p>";"<p>Системный телефон с 16 программируемыми клавишами со световой индикацией. Трехстрочный информационный дисплей. 3 контекстные клавиши. Клавиши быстрой навигации. Спикерфон (громкая связь). Поддержка дочерних модулей. Световой индикатор вызова./p></p>";"84-148-thickbox.jpg";"84-148-thickbox.jpg";"84-148-thickbox.jpg";"84-148-thickbox.jpg"
"Очень большая";"85";1;"Цифровая системная консоль PANASONIC KX-T7440";"97.00";"";"<p>Консоль для цифровых системных телефонов Panasonic включает 66 программируемых кнопок прямого выбора абонента, 66 кнопок поля индикаторов занятости линии.</p>";"<p>Консоль для цифровых системных телефонов Panasonic включает 66 программируемых кнопок прямого выбора абонента, 66 кнопок поля индикаторов занятости линии.</p>";"85-150-thickbox.jpg";"85-150-thickbox.jpg";"85-150-thickbox.jpg";"85-150-thickbox.jpg"
"Очень большая";"79";1;"Радиостанция Motorola TLKR-T4";"40.00";"";"<p>Простая, компактная и легкая рация дальность до 6 км (в зависимости от рельефа местности и условий).</p>";"<p>Простая, компактная и легкая рация дальность до 6 км (в зависимости от рельефа местности и условий). Бесплатные звонки. 8 каналов. Сканирование/мониторинг. ЖК-дисплей. Клипса на ремень и петля для ношения. Блокировка клавиатуры. Индикатор заряда батареи. Мощность передатчика 0.5 Вт. 1 мелодия вызова. Звуки клавиатуры.</p>";"79-141-thickbox.jpg";"79-141-thickbox.jpg";"79-141-thickbox.jpg";"79-141-thickbox.jpg"
"Очень большая";"75";1;"Bluetooth гарнитура Plantronics Voyager 835";"75.00";"";"<p>Гарнитура сочетает в себе сразу три технологии шумоподавления, которые в совокупности обеспечивают идеальную ясность и естественное звучание голоса в обоих направлениях.</p>";"<p>Гарнитура сочетает в себе сразу три технологии шумоподавления, которые в совокупности обеспечивают идеальную ясность и естественное звучание голоса в обоих направлениях. Технология Multipoint позволяет использовать данную гарнитуру для работы сразу с двумя Bluetooth устройствами. Работает до 5 часов в режиме разговора и до 7 дней в режиме ожидания. В комплекте с гарнитурой поставляется зарядное устройство от сети, а также уникальное автомобильное зарядное устройство.</p>";"75-135-thickbox.jpg";"75-135-thickbox.jpg";"75-135-thickbox.jpg";"75-135-thickbox.jpg"
"Очень большая";"19";1;"Газовая плита Ardo D662 RNS";"840.00";"";"<p>Тип плиты газовая</p><p>Тип духовки газовая</p><p>Цвет чёрный</p>";"<p>Тип плиты газовая</p><p>Тип духовки газовая</p><p>Цвет чёрный</p><p>Высота, cм 85</p><p>Ширина, см 60</p><p>Глубина, cм 60</p><p>Количество конфорок (газ+электро) 4+0</p><p>Газ-контроль конфорок есть</p><p>Газ-контроль духовки и гриля есть</p><p>Тип решеток чугун</p><p>Гриль газовый</p><p>Вертел есть</p><p>Электроподжиг автоматический</p><p>Подсветка есть</p><p>Термостат есть</p><p>Двойное стекло дверей духовки есть</p><p>Объем духовки, л 56</p>";"19-40-thickbox.jpg";"19-40-thickbox.jpg";"19-40-thickbox.jpg";"19-40-thickbox.jpg"
"Очень большая";"1";1;"Аэрогриль VES 797";"100.00";"";"<p>Аэрогриль ves 797 – компактный и функциональный прибор с регулируемым термостатом. Объем чаши аэрогриля механического ves 797 составляет 12 литров, при использовании расширительного кольца он увеличивается до 17 литров. Аэрогриль оборудован устройством защиты от включения и автоматически отключается при поднятии ручки на 90 градусов.</p>";"<p>Аэрогриль ves 797 – компактный и функциональный прибор с регулируемым термостатом. Объем чаши аэрогриля механического ves 797 составляет 12 литров, при использовании расширительного кольца он увеличивается до 17 литров. Аэрогриль оборудован устройством защиты от включения и автоматически отключается при поднятии ручки на 90 градусов.</p><p>Содержит галогенный нагревательный элемент, сокращающий срок приготовления пищи в несколько раз. Аэрогриль ves 797 имеет корпус, изготовленный из термостойкого стекла. База аэрогриля – с металлическим основанием. Таймер аэрогриля рассчитан на 60 минут.</p><p>Мощность аэрогриля ves 797 составляет 1350 Вт. В нем предусмотрена функция автоматической чистки и мойки. Гарантийный срок службы аэрогриля ves 797 – 1 год.</p><p>Набор аксессуаров аэрогриля: расширительное кольцо, двойная решетка, подставка под крышку, пароварка.</p>";"1-2-thickbox.jpg";"1-2-thickbox.jpg";"1-2-thickbox.jpg";"1-2-thickbox.jpg"
"Очень большая";"13";1;"Посудомоечная машина Siemens SN 26 T 552 EU";"1490.00";"";"<p>Посудомоечная машина с электронным управлением на 13 комплектов посуды. 6 программ. Cенсорные клавиши панели управления. Акустический сигнал окончания хода программы. Tаймер запуска с установкой от 1 до 24 ч.</p>";"<p>Посудомоечная машина с электронным управлением на 13 комплектов посуды. 6 программ. Cенсорные клавиши панели управления. Акустический сигнал окончания хода программы. Tаймер запуска с установкой от 1 до 24 ч. Электронные индикаторы наличия соли и ополаскивателя. Переставляемый по высоте верхний короб. Датчик загрузки. Автоматическая функция «3 в 1». Электроника регенерирования. Tехнология попеременной подачи воды. Cистема защиты стеклянной посуды. Tеплообменник. Mеханическая блокировка от детей. Защита от протечек. Проточный водонагреватель, совмещенный с помпой. Цвет: серебристый.</p>";"13-26-thickbox.jpg";"13-26-thickbox.jpg";"13-26-thickbox.jpg";"13-26-thickbox.jpg"
