"cat";"num";"act ";"name";"prc";"brd";"shdesc";"desc";"mimg";"simg";"modim";"modis"
"Большие цены";"55";1;"Гайковерт Bosch GDS 12 V";"13420.00";"";"<p>Аккумуляторный ударный гайковерт, высокий крутящий момент и сила удара</p>";"<p>Аккумуляторный ударный гайковерт, высокий крутящий момент и сила удара, компактная и эргономичная форма, встроенная подсветка с 3 светодиодами для освещения рабочей зоны, металлический корпус редуктора для высочайшей точности и долгого срока службы, 2 аккумулятора NiMH емкостью 2,6 Ач, зажим для переноски на ремне, петля на руку, реверс, безопасная работа без обратного удара, управляющая электроника, рукоятка с мягкой накладкой.</p>";"55-107-thickbox.jpg";"55-107-thickbox.jpg";"55-107-thickbox.jpg";"55-107-thickbox.jpg"
"Большие цены";"57";1;"Компрессор Remeza СБ4С270.АВ670";"251580.00";"";"<p>Используется в бытовых целях и промышленных условиях как источник сжатого воздуха для пневмоинструмента, окрасочных работ, автосервиса и т. д.</p>";"<p>Используется в бытовых целях и промышленных условиях как источник сжатого воздуха для пневмоинструмента, окрасочных работ, автосервиса и т. д.</p>";"57-109-thickbox.jpg";"57-109-thickbox.jpg";"57-109-thickbox.jpg";"57-109-thickbox.jpg"
"Большие цены";"82";1;"Радиотелефон Dect Panasonic KX-TCD815";"32120.00";"";"<p>Радиотелефон стандарта DECT/GAP. Загрузка картинок и мелодий с ПК или мобильного телефона (встроенный ИК-порт, в комплекте кабель USB).</p>";"<p>Радиотелефон стандарта DECT/GAP. Загрузка картинок и мелодий с ПК или мобильного телефона (встроенный ИК-порт, в комплекте кабель USB). Автоматический определитель номера: АОН, Caller ID (журнал на 50 вызовов). Проговаривание голосом номера. Большой графический цветной дисплей - 65000 цветов. 6 обычных + 14 полифонических мелодий звонка. Загрузка мелодий с любого аудио-устройства через кабель. Меню и телефонный справочник на русском языке (200 номеров). Возможность присваивания до 3-х номеров телефонов и картинки для одной записи. Редактирование записей с помощью ПК. Функция Нянька. Спикерфон (громкая связь) на трубке. Дата, часы, будильник. Повторный набор последних 5-ти набранных номеров. Подключение гарнитуры. Ночной режим. Кнопка Flash для переадресация на мини-АТС. Подключение до 6-ти трубок на одну базу. Подключение одной трубки на 4 базы. Конференц-связь. Внутренняя связь между трубками. Переадресация внешнего звонка между трубками. Подключение к видеодомофонной системе.</p>";"82-145-thickbox.jpg";"82-145-thickbox.jpg";"82-145-thickbox.jpg";"82-145-thickbox.jpg"
"Большие цены";"89";1;"Факсимильный аппарат Panasonic KX-FC258RU";"42265.00";"";"<p>Двухстрочный дисплей. Беспроводная DECT трубка с цветным дисплеем. Печать по принципу термопереноса.</p>";"<p>Двухстрочный дисплей. Беспроводная DECT трубка с цветным дисплеем. Печать по принципу термопереноса. Цифровой дуплексный спикерфон. Цифровой автоответчик. Время записи - 15 минут. Скорость модема - до 9,6 Кбит/с. Кнопка навигации. Автоподатчик на 10 листов. Лоток на 20 листов. Отложенная передача. Прием при отсутствии бумаги (до 28 страниц). Набор 100 номеров из памяти. Функция копирования с возможностью масштабирования.</p>";"89-154-thickbox.jpg";"89-154-thickbox.jpg";"89-154-thickbox.jpg";"89-154-thickbox.jpg"
"Большие цены";"91";1;"Коммуникатор ASUS MyPal A639";"24530.00";"";"<p>Операционная система Windows Mobile 5.0 for Pocket PC. Процессор Intel XScale PXA270 416 МГц. Оперативная память 64 Мб, Flash-память ROM 1 Гб. Интерфейсы: SD/MMC с поддержкой SDIO, IrDA, Bluetooth 2.0+EDR, Wi-Fi (IEEE802.11b/g), USB 1.1 клиент (синхронизация, заряд, кард-ридер).</p>";"<p>Операционная система Windows Mobile 5.0 for Pocket PC. Процессор Intel XScale PXA270 416 МГц. Оперативная память 64 Мб, Flash-память ROM 1 Гб. Интерфейсы: SD/MMC с поддержкой SDIO, IrDA, Bluetooth 2.0+EDR, Wi-Fi (IEEE802.11b/g), USB 1.1 клиент (синхронизация, заряд, кард-ридер). Встроенный GPS-приемник SiRF Star III, внешняя поворотная антенна, разъем для подключения дополнительной антенны. Экран 3.5” c разрешением 240х320 точек, 64 тысячи цветов.</p>";"91-156-thickbox.jpg";"91-156-thickbox.jpg";"91-156-thickbox.jpg";"91-156-thickbox.jpg"
"Нецелые цены";"5";1;"Миксер Philips HR1565";"90.90";"";"<p>Легкое приготовление домашних дессертов Миксер с поворачивающейся чашей Приготовление изысканных домашних тортов, пирогов и выпечки для всей семьи еще никогда не было настолько простым. Этот 350 Вт миксер Philips с подставкой и чашей сделает за вас всю трудную работу, за минуты приготовив идеальные смеси. Ваш верный и надежный помощник на кухне.</p>";"<p>Легкое приготовление домашних дессертов Миксер с поворачивающейся чашей Приготовление изысканных домашних тортов, пирогов и выпечки для всей семьи еще никогда не было настолько простым. Этот 350 Вт миксер Philips с подставкой и чашей сделает за вас всю трудную работу, за минуты приготовив идеальные смеси. Ваш верный и надежный помощник на кухне.</p><p>Свободные руки при смешивании Вращающаяся чаша емкостью 3 л Подставка миксера</p><p>Идеальное тесто и десерты за несколько минут Мощный (350 Ватт) мотор Различные скоростные режимы и турборежим</p><p>Идеально взбивает и смешивает Насадки для взбивания и для теста в комплекте</p><p>Быстрая и простая чистка Удобная лопаточка</p><p>Удобство хранения Зажим для шнура</p><p>Общие характеристики Режимы скоростей: 3 Кнопка включения турборежима Зажим для шнура</p><p>Технические характеристики Мощность: 350 Вт Напряжение: 230-240 В Частота: 50/60 Гц Длина шнура: 1,50 м</p><p>Характеристики дизайна Материал, из которого изготовлен корпус: ABS Материал насадок для взбивания/для теста: Из нержавеющей стали</p><p>Принадлежности Насадки для взбивания Насадки для теста</p><p>Дата выпуска 2008-05-21</p>";"5-12-thickbox.jpg";"5-12-thickbox.jpg";"5-12-thickbox.jpg";"5-12-thickbox.jpg"
"Нецелые цены";"7";1;"Универсальная соковыжималка Philips HR186630";"180.80";"";"<p>Тип универсальная</p><p>Мощность 800 Вт</p><p>Резервуар для сока стакан, объем 1.25 л</p><p>Система прямой подачи сока есть</p><p>Система капля-стоп есть</p><p>Сбор мякоти автоматический выброс мякоти, объем резервуара 2 л</p><p>Сепаратор для пены есть</p><p>Защитные функции защита от случайного включения</p>";"<p>Тип универсальная</p><p>Мощность 800 Вт</p><p>Резервуар для сока стакан, объем 1.25 л</p><p>Система прямой подачи сока есть</p><p>Система капля-стоп есть</p><p>Сбор мякоти автоматический выброс мякоти, объем резервуара 2 л</p><p>Сепаратор для пены есть</p><p>Защитные функции защита от случайного включения</p><p>Технические характеристики</p><p>Тип универсальная</p><p>Мощность 800 Вт</p><p>Резервуар для сока стакан, объем 1.25 л</p><p>Система прямой подачи сока есть</p><p>Система капля-стоп есть</p><p>Сбор мякоти автоматический выброс мякоти, объем резервуара 2 л</p><p>Сепаратор для пены есть</p><p>Защитные функции защита от случайного включения</p><p>Особенности</p><p>Материал корпуса алюминий</p><p>Материал сетки центрифуги нерж. сталь</p><p>Круглая горловина есть</p><p>Размер горловины 74 мм</p><p>Комплектация щеточка для чистки</p><p>Прорезиненные ножки есть</p><p>Отсек для сетевого шнура длина 1.2 м</p><p>Управление</p><p>Количество скоростей 2</p>";"7-14-thickbox.jpg";"7-14-thickbox.jpg";"7-14-thickbox.jpg";"7-14-thickbox.jpg"
"Нецелые цены";"11";1;"Чаеварка-чайник BOSCH TTA 2009";"80.70";"";"<p>Цвет: бежевый/серый, серебристый</p><p>Мощность: 1785 Вт макс.</p><p>Объем заварника: 0,7 л</p><p>Объем чайника: 2,0 л</p>";"<p>Цвет: бежевый/серый, серебристый</p><p>Мощность: 1785 Вт макс.</p><p>Объем заварника: 0,7 л</p><p>Объем чайника: 2,0 л</p><p>Чайник из полупрозрачного пластика со шкалой уровня воды</p><p>Стеклянный заварник с крышкой</p><p>Ситечко для заварки из нержавеющей стали</p><p>Круговой светоиндикатор «Улыбка»</p><p>Крышка для чайника в комплекте</p><p>Скрытый нагревательный элемент, дно из нержавеющей стали</p><p>Автоматическое переключение на режим подогрева</p><p>Цоколь с центральным контактом позволяет устанавливать чайник в любом положении</p><p>Клавиша переключения режимов кипячения и нагрева</p><p>Клавиша «включения/отключения» прибора</p><p>Намотка кабеля в цоколе</p>";"11-23-thickbox.jpg";"11-23-thickbox.jpg";"11-23-thickbox.jpg";"11-23-thickbox.jpg"
"Нецелые цены";"12";1;"Мясорубка AEG FW 5549";"145.50";"";"<p>Технические характеристикиМощность 400 ВтСистема реверса естьНасадкиПерфорированный диск для фарша есть</p>";"<p>Технические характеристикиМощность 400 ВтСистема реверса естьНасадкиПерфорированный диск для фарша есть, 3 в комплектеНасадка-терка нетНасадка для шинковки нетНасадка для приготовления колбас естьПрочие насадки для кеббе, для нарезки печеньяОсобенностиМатериал лотка металлМатериал корпуса металлПрорезиненные ножки естьОтсек для хранения шнура естьДополнительная информация максимальная мощность 1000 Вт</p>";"12-25-thickbox.jpg";"12-25-thickbox.jpg";"12-25-thickbox.jpg";"12-25-thickbox.jpg"
"Нецелые цены";"18";1;"Хлебопечка Tefal Dual Home Baker OW4002";"180.30";"";"<p>Мощность 680 Вт. Запрограммированный старт через 15 часов. Запас памяти на 7 минут при сбое электропитания. Антипригарное покрытие бака. 13 программ приготовления. 3 варианта веса хлеба (750 г, 1 кг и 1,2 кг). 3 цвета корочки.</p>";"<p>Мощность 680 Вт. Запрограммированный старт через 15 часов. Запас памяти на 7 минут при сбое электропитания. Антипригарное покрытие бака. 13 программ приготовления. 3 варианта веса хлеба (750 г, 1 кг и 1,2 кг). 3 цвета корочки.</p>";"18-37-thickbox.jpg";"18-37-thickbox.jpg";"18-37-thickbox.jpg";"18-37-thickbox.jpg"
"Нецелые цены";"21";1;"Детское автокресло Bebe Confort Iseos Safe Side TT";"300.99";"";"<p>Автокресло рекомендуется для детей от 9 кг (1-4 года). Оснащено системой дополнительного натяжения ремней, которыми кресло крепится к сиденью автомобиля, что упрощает и ускоряет его правильную установку.</p>";"<p>Автокресло рекомендуется для детей от 9 кг (1-4 года). Оснащено системой дополнительного натяжения ремней, которыми кресло крепится к сиденью автомобиля, что упрощает и ускоряет его правильную установку. Установка в автомобиле: по ходу движения с помощью штатного 3-точечного ремня безопасности. В кресле используется двойная система Modulo Safe, позволяющая плавно изменять ширину (от 40 до 55 см) и наклон кресла, внутренние 5-точечные ремни безопасности регулируются по росту ребенка. Прочный корпус на широкой платформе разработан с учетом геометрии салонов современных автомобилей. Усиленная боковая защита Safe Side. Защитные накладки на ремнях двух размеров, в зависимости от возраста ребенка. Система Легкая посадка, фиксирующая внутренние ремни по сторонам, на боковинах и не мешающие посадке ребенка. Высококачественное, мягкое, дышащее покрытие (снимается и стирается). Система Total Tension обеспечивает правильную установку с меньшими усилиями. Вес автокресла: 9 кг.</p>";"21-42-thickbox.jpg";"21-42-thickbox.jpg";"21-42-thickbox.jpg";"21-42-thickbox.jpg"
"Нецелые цены";"34";1;"BABYONO 238 Набор посуды для кормления";"15.99";"";"<p>Тарелочка с подогревом, диаметр 17,5 см</p><p>Обеденные наборы BabyOno это все, что необходимо для Твоего ребёнка во время еды</p><p>Набор предназначен для детей от 1-го года, однако если заметите, что Ваш ребёнок захочет раньше начать есть самостоятельно, то ничто не мешает, ему делать это ещё до года.</p>";"<p>Тарелочка с подогревом, диаметр 17,5 см</p><p>Обеденные наборы BabyOno это все, что необходимо для Твоего ребёнка во время еды</p><p>Набор предназначен для детей от 1-го года, однако если заметите, что Ваш ребёнок захочет раньше начать есть самостоятельно, то ничто не мешает, ему делать это ещё до года.</p><p>В набор входит</p><p>* тарелка с подогревом и присоской</p><p>* кружка-непроливайка</p><p>* столовые приборы</p><p>Производство: BabyOno, Польша</p>";"34-79-thickbox.jpg";"34-79-thickbox.jpg";"34-79-thickbox.jpg";"34-79-thickbox.jpg"
"Нецелые цены";"31";1;"Пеленальный столик Baby Prestige Simplicity";"91.80";"";"<p>Пеленальный столик очень устойчив благодаря широкой основе. Ванночка анатомической формы с дренажной трубкой для слива воды. Имеется полочка для хранения банных принадлежностей. Занимает мало места. Высота - 98 см. Длина - 75 см. Ширина - 58 см.</p>";"<p>Пеленальный столик очень устойчив благодаря широкой основе. Ванночка анатомической формы с дренажной трубкой для слива воды. Имеется полочка для хранения банных принадлежностей. Занимает мало места. Высота - 98 см. Длина - 75 см. Ширина - 58 см.</p>";"31-73-thickbox.jpg";"31-73-thickbox.jpg";"31-73-thickbox.jpg";"31-73-thickbox.jpg"
"Нецелые цены";"28";1;"Кровать BERTONI CLASSIC";"180.20";"";"<p>Внутренний размер кроватки: 120х60 см. Выдвижной ящик. Специальные фиксаторы качания. Варианты цветовой гаммы: голубая и розовая.</p>";"<p>Внутренний размер кроватки: 120х60 см. Выдвижной ящик. Специальные фиксаторы качания. Варианты цветовой гаммы: голубая и розовая.</p>";"28-65-thickbox.jpg";"28-65-thickbox.jpg";"28-65-thickbox.jpg";"28-65-thickbox.jpg"
"Нецелые цены";"30";1;"Манеж BERTONI ARENA 2+ уровня";"120.89";"";"<p>2 уровня: для сна и игры. Собирается до компактного размера. Легко переносить. Игрушка для ребёнка. Размеры: 120x60x77 см. Варианты цветовой гаммы: blue-orange, blue-yellow, green-orange.</p>";"<p>2 уровня: для сна и игры. Собирается до компактного размера. Легко переносить. Игрушка для ребёнка. Размеры: 120x60x77 см. Варианты цветовой гаммы: blue-orange, blue-yellow, green-orange.</p>";"30-70-thickbox.jpg";"30-70-thickbox.jpg";"30-70-thickbox.jpg";"30-70-thickbox.jpg"
"Нецелые цены";"44";1;"Ортопедический матрас Барро Элит 501 160 x 200";"231.30";"";"<p>Ортопедический классический матрас на основе пружинного блока TFK. Симметричный матрас с традиционной компоновкой пенополиуретана с двух сторон и холстопрошивного ватина. А так же иглопробивным натуральным полотном и по периметру - 40мм пенополиуретаном. Съемный чехол матраса (стеганый жакард).</p>";"<p>Ортопедический классический матрас на основе пружинного блока TFK. Симметричный матрас с традиционной компоновкой пенополиуретана с двух сторон и холстопрошивного ватина. А так же иглопробивным натуральным полотном и по периметру - 40мм пенополиуретаном. Съемный чехол матраса (стеганый жакард).</p>";"44-95-thickbox.jpg";"44-95-thickbox.jpg";"44-95-thickbox.jpg";"44-95-thickbox.jpg"
"Нецелые цены";"45";1;"Сейф взломостойкий Valberg ASK-46";"500.50";"";"<p>Сейф предназначен для хранения ценных вещей, в том числе и достаточно крупных денежных сумм, как дома, так и в офисе.</p>";"<p>Сейф предназначен для хранения ценных вещей, в том числе и достаточно крупных денежных сумм, как дома, так и в офисе. Сертификация по I классу защиты от взлома. Корпус сейфа имеет трехслойную конструкцию: внешняя стенка, бетон, внутренняя стенка. Стенки сейфа выполнены из стального листа толщиной от 1 до 3 мм. Ключевой 8-сувальдный замок Mauer (Германия). Замок защищен от высверливания специальной твердосплавной пластиной. Сейф оснащен 3-сторонней ригельной системой запирания с тремя никелированными вращающимися ригелями, диаметром 25 мм и одним пассивным ригелем.</p>";"45-96-thickbox.jpg";"45-96-thickbox.jpg";"45-96-thickbox.jpg";"45-96-thickbox.jpg"
"Нецелые цены";"50";1;"Каминный набор №859 кованый (Аксессуары для каминов)";"45.50";"";"<p>Размер см: 24х28х64 (Ш х Д х В)</p>";"<p>Размер см: 24х28х64 (Ш х Д х В)</p><p>Цвет: Старое золото</p><p>Пр-во: Польша</p>";"50-102-thickbox.jpg";"50-102-thickbox.jpg";"50-102-thickbox.jpg";"50-102-thickbox.jpg"
"Нецелые цены";"51";1;"Бензобур Pacme EL-ED1700";"260.60";"";"<p>Бензобур мощностью 1.7 кВт. Диаметр бура 150 мм. Возможность установки буров диаметром: 100, 200, 250 мм.</p>";"<p>Бензобур мощностью 1.7 кВт. Диаметр бура 150 мм. Возможность установки буров диаметром: 100, 200, 250 мм.</p>";"51-103-thickbox.jpg";"51-103-thickbox.jpg";"51-103-thickbox.jpg";"51-103-thickbox.jpg"
"Нецелые цены";"56";1;"Миксер электрический Graphite 58G782";"175.50";"";"<p>Миксер электрический в чемоданчике с мешалкой.</p>";"<p>Миксер электрический в чемоданчике с мешалкой. Мощность 1200 Вт. Патрон M14. Скорость I: 0-580, II: 0-760 об/мин.</p>";"56-108-thickbox.jpg";"56-108-thickbox.jpg";"56-108-thickbox.jpg";"56-108-thickbox.jpg"
