"Артикул ";"Наименование ";"Цена";"На складе ";"Описание ";"Краткое описание ";"Заголовок страницы ";"Тэг META keywords ";"Тэг META description ";"Фотография ";"Фотография ";"Фотография ";"Фотография ";"Фотография ";"Фотография ";"Фотография ";"Фотография ";"Фотография ";"Фотография ";"Производитель"
"1011_138";"Парсер товаров Яндекс Маркета";"54.99";100;"<p>Парсер Яндекс-Маркет – отдельная и специальная сборка парсера Catalog Loader для скачивания товаров из торговой площадки Яндекс-Маркет. Преимущества парсера Яндекс-Маркет перед аналогами: - Программа работает под Windows (XP / 7 / 2003 / 2008). - Установка программы не требует никаких специальных знаний и навыков, устанавливается как обычное приложение Windows (далее, далее… готово). - Максимально упрощенный и понятный интерфейс. Параметры, которые извлекаются парсером Яндекс-Маркет в стандартной конфигурации: - структура каталога; - имя товара; - цена товара; - краткое описание; - полное описание (в виде одной таблицы); - 1 основное (если отсутствует увеличенное изображение, берется маленькое)? + 3 дополнительных изображения; - производитель;? - meta_title?, meta_description?, meta_keywords;?? - возможно расширение стандартной версии дополнительными параметрами и возможностями (изменение цены по формуле, разбиение описания на характеристики и т.д.). Копирование товаров происходит с задержкой (в избежании бана), поддержка прокси-серверов. Экспорт товаров парсером Яндекс-Маркет происходит в csv для следующих CMS: - PrestaShop, - VamShop, - Virtuemart(Joomla), - ShopScript, - ShopCMS - ABO, - Amiro, - PhpShop, - HostCMS, - TomatoCart?, - CS-Cart??, - возможно подключение любой другой CMS или нужного формата csv (бесплатно). Возможность возобновления процесса парсинга с предыдущего состояние в случае какого-либо сбоя (выкл. электричества и т.п. ) или ручной остановки парсера. После оформления заказа Вам будет выслана ссылка на скачивание программы, а так ?же логин и пароль для запуска программы (в будние дни логин и пароль высылается в течении 5-45 мин после поступления оплаты, в выходные дни возможна задержка в несколько часов). Парсер копирует товары, информация о которых размещена на Я.Маркет. Товары, для которых предоставлены только анонсы со ссылками на другие источники не копируются. Постоянное бесплатное обновление сборки парсера.</p><p>Наш продукт ShopDataGetway - это система предоставляющая вашим партнерам возможность мгновенно обновлять интернет-магазины используя данные из ваших систем. Система предоставляет вашим партнерам данные в требуемом им виде. С помощью продукта ShopDataGetway вы позволяете вашим партнерам избежать лишних затрат на автоматизицию бизнес-процессов.</p><p>CatalogLoader– это пакет программного обеспечение, представляющее собой набор инструментов для работы с товарамиинтернет-магазинов (парсер, автоматическое наполнение, изменение цен, обработка склада, мониторинг конкурентов).</p>";"<p>Парсер Яндекс-Маркет – отдельная и специальная сборка парсера Catalog Loader для скачивания товаров из торговой площадки Яндекс-Маркет.</p>";"Парсер товаров Яндекс Маркета";"";"";"138-247-thickbox_small.jpg,138-247-thickbox_medium.jpg,138-247-thickbox.jpg";"138-248-thickbox_small.jpg,138-248-thickbox_medium.jpg,138-248-thickbox.jpg";"138-249-thickbox_small.jpg,138-249-thickbox_medium.jpg,138-249-thickbox.jpg";"138-250-thickbox_small.jpg,138-250-thickbox_medium.jpg,138-250-thickbox.jpg";"138-251-thickbox_small.jpg,138-251-thickbox_medium.jpg,138-251-thickbox.jpg";"";"";"";"";"";""
"1011_139";"Парсер товаров focalprice.com";"79.00";100;"<p>Парсер focalprice.com – отдельная и специальная сборка парсера Catalog Loader для скачивания товаров из интернет-магазина focalprice.com.</p><p>Преимущества парсера focalprice.com перед аналогами: - Программа работает под Windows (XP / 7 / 2003 / 2008). - Установка программы не требует никаких специальных знаний и навыков, устанавливается как обычное приложение Windows (далее, далее… готово). - Максимально упрощенный и понятный интерфейс. Парсером focalprice.com извлекается: - Структура каталога - Имя товара - Артикул - Краткое описание товара (в качестве краткого описания Имя товара) - Полное описание товара (без разбиения на параметры, ссылки (ссылки на картинки) в тексте описания удаляются) - Изображение (1-6шт.) - Цена (если имеется скидка на товара, берется цена по скидке) - meta_title?, meta_description?, meta_keywords;? - Возможно расширение стандартной версии дополнительными параметрами и возможностями (изменение цены по формуле, разбиение описания на характеристики, мониторинг и сравнение цен и т.д.). Экспорт товаров парсером focalprice.com происходит в csv для следующих CMS: - PrestaShop, - VamShop, - Virtuemart(Joomla), - ShopScript, - ABO, - Amiro, - PhpShop, - HostCMS, - возможно подключение любой другой CMS или нужного формата csv (бесплатно). Возможность возобновления процесса парсинга с предыдущего состояние в случае какого-либо сбоя (выкл. электричества и т.п. ) или ручной остановки парсера. После оформления заказа Вам будет выслана ссылка на скачивание программы.</p><p>Наш продукт ShopDataGetway - это система предоставляющая вашим партнерам возможность мгновенно обновлять интернет-магазины используя данные из ваших систем. Система предоставляет вашим партнерам данные в требуемом им виде. С помощью продукта ShopDataGetway вы позволяете вашим партнерам избежать лишних затрат на автоматизицию бизнес-процессов.</p><p>CatalogLoader– это пакет программного обеспечение, представляющее собой набор инструментов для работы с товарамиинтернет-магазинов (парсер, автоматическое наполнение, изменение цен, обработка склада, мониторинг конкурентов).</p>";"<p>Парсер focalprice.com – отдельная и специальная сборка парсера Catalog Loader для скачивания товаров из интернет-магазина focalprice.com.</p><p>Преимущества парсера focalprice.com перед аналогами:</p>";"Парсер товаров focalprice.com";"";"";"139-252-thickbox_small.jpg,139-252-thickbox_medium.jpg,139-252-thickbox.jpg";"139-253-thickbox_small.jpg,139-253-thickbox_medium.jpg,139-253-thickbox.jpg";"139-254-thickbox_small.jpg,139-254-thickbox_medium.jpg,139-254-thickbox.jpg";"";"";"";"";"";"";"";""
"1011_140";"Парсер товаров zappos.com";"159.00";100;"<p>Парсер zappos.com?? – отдельная и специальная сборка парсера Catalog Loader для скачивания товаров из zappos.com?.</p><p>Парсер товаров из интернет-магазина zappos.com очень быстро и качественно наполнит Ваш интернет-магазин всем представленым там ассортиментом.</p><p>Вы должны выбрать именно этот парсер zappos.com, т.к. он имеет ряд преимуществ перед аналогами, например:</p><p>- Программа работает под Windows (XP / 7 / 2003 / 2008).</p><p>- Устанавливается быстро и не потребует от Вас каких-либо дополнительных знаний ПК.</p><p>- Специально для Вас интерфейс программы максимально упрощён и будет понятен даже неопытному пользователю.</p><p>В обычной сборке прасер интернет-магазина zappos.com извлекает следующие параметры:</p><p>- структуру каталога;</p><p>- имя товара;</p><p>- цену товара;</p><p>- краткое описание;</p><p>- полное описание;</p><p>- изображение (увеличенное);</p><p>- meta_title?, meta_description?, meta_keywords;</p><p>- дополнительно осуществляется расширение стандартной версии желаемыми параметрами и возможностями (изменение цены по формуле, мониторинг и сравнение цен и т.д.).</p><p>Товары экспортируются в csv для следующих CMS:</p><p>- PrestaShop,</p><p>- VamShop,</p><p>- Virtuemart(Joomla),</p><p>- ShopScript,</p><p>- ABO,</p><p>- Amiro,</p><p>- PhpShop,</p><p>- HostCMS,?</p><p>- бесплатно подключается любая другая CMSили нужный формат csv.</p><p>Программа возобновляет процесс парсинга с состояния разрыва при любом сбое (выкл. электричества и т.д.).</p><p>После оформления заказа Вам будет выслана ссылка на скачивание программы. ?</p><p>Наш продукт ShopDataGetway - это система предоставляющая вашим партнерам возможность мгновенно обновлять интернет-магазины используя данные из ваших систем. Система предоставляет вашим партнерам данные в требуемом им виде. С помощью продукта ShopDataGetway вы позволяете вашим партнерам избежать лишних затрат на автоматизицию бизнес-процессов.</p><p>CatalogLoader– это пакет программного обеспечение, представляющее собой набор инструментов для работы с товарамиинтернет-магазинов (парсер, автоматическое наполнение, изменение цен, обработка склада, мониторинг конкурентов).</p>";"<p>Парсер zappos.com?? – отдельная и специальная сборка парсера Catalog Loader для скачивания товаров из zappos.com?.</p>";"Парсер товаров zappos.com";"";"";"140-255-thickbox_small.jpg,140-255-thickbox_medium.jpg,140-255-thickbox.jpg";"140-256-thickbox_small.jpg,140-256-thickbox_medium.jpg,140-256-thickbox.jpg";"";"";"";"";"";"";"";"";""
"1011_141";"Парсер товаров beautymania.ru";"109.00";100;"<p>Парсер beautymania.ru – отдельная и специальная сборка парсера Catalog Loader для скачивания товаров из интернет-магазина косметики по уходу за волосами, телом, лицом ?beautymania.ru. В этом интернет-магазине вы найдете рубрики с косметикой по уходу за телом, лицом, волосами, а также рубрику с косметикой для мужчин.</p><p>Каждый товар иметт фотографию, описание, стоимость. Все эти данные можно без труда скачать и загрузить в Ваш интернет-магазин с помощью парсера beautymania.ru?.</p><p>Преимущества парсера beautymania.ru перед аналогами:</p><p>- Программа работает под Windows (XP / 7 / 2003 / 2008).</p><p>- Установка программы не требует никаких специальных знаний и навыков, устанавливается как обычное приложение Windows (далее, далее… готово).</p><p>- Максимально упрощенный и понятный интерфейс.</p><p>Параметры, которые извлекаются парсером beautymania.ru в стандартной конфигурации:</p><p>- структура каталога;</p><p>- имя товара;</p><p>- цена товара;</p><p>- краткое описание;</p><p>- полное описание;</p><p>- изображение (увеличенное);</p><p>- производитель;</p><p>- meta_title?, meta_description?, meta_keywords;</p><p>- возможно расширение стандартной версии дополнительными параметрами и возможностями (изменение цены по формуле, мониторинг и сравнение цен и т.д.).</p><p>Экспорт товаров парсером beautymania.ru происходит в csv для следующих CMS:</p><p>- PrestaShop,</p><p>- VamShop,</p><p>- Virtuemart(Joomla),</p><p>- ShopScript,</p><p>- ABO,</p><p>- Amiro,</p><p>- PhpShop,</p><p>- HostCMS,?</p><p>- возможно подключение любой другой CMS или нужного формата csv (бесплатно).</p><p>Возможность возобновления процесса парсинга с предыдущего состояние в случае какого-либо сбоя (выкл. электричества и т.п. ) или ручной остановки парсера.</p><p>После оформления заказа Вам будет выслана ссылка на скачивание программы.</p><p>Наш продукт ShopDataGetway - это система предоставляющая вашим партнерам возможность мгновенно обновлять интернет-магазины используя данные из ваших систем. Система предоставляет вашим партнерам данные в требуемом им виде. С помощью продукта ShopDataGetway вы позволяете вашим партнерам избежать лишних затрат на автоматизицию бизнес-процессов.</p><p>CatalogLoader– это пакет программного обеспечение, представляющее собой набор инструментов для работы с товарамиинтернет-магазинов (парсер, автоматическое наполнение, изменение цен, обработка склада, мониторинг конкурентов).</p>";"<p>Парсер beautymania.ru – отдельная и специальная сборка парсера Catalog Loader для скачивания товаров из интернет-магазина косметики по уходу за волосами, телом, лицом ?beautymania.ru. В этом интернет-магазине вы найдете рубрики с косметикой по уходу за телом, лицом, волосами, а также рубрику с косметикой для мужчин.</p>";"Парсер товаров beautymania.ru";"";"";"141-257-thickbox_small.jpg,141-257-thickbox_medium.jpg,141-257-thickbox.jpg";"141-258-thickbox_small.jpg,141-258-thickbox_medium.jpg,141-258-thickbox.jpg";"";"";"";"";"";"";"";"";""
0;;Три уровня вложенности;;;;;;;;;;;;;;;;
"1012_115";"Напольные весы Beurer BG55";"125.00";100;"<p>Индикация с указанием содержания: жира, воды, мышечной и костной массы тела. Атлетический режим. Литиевая батарея в комплекте. Технология Tap-on. Платформа из безопасного прочного стекла.</p>";"<p>Индикация с указанием содержания: жира, воды, мышечной и костной массы тела.</p>";"Напольные весы Beurer BG55";"";"";"115-208-thickbox_small.jpg,115-208-thickbox_medium.jpg,115-208-thickbox.jpg";"115-209-thickbox_small.jpg,115-209-thickbox_medium.jpg,115-209-thickbox.jpg";"";"";"";"";"";"";"";"";""
"1012_116";"Напольные весы Beurer GS21 Mauritius";"65.00";100;"<p>Напольные весы со стеклянной платформой с оригинальным дизайном MaterialLine (покрытие из ламината). Максимальная нагрузка 180 кг. Погрешность измерения 0.1 кг. Автоматическое отключение. Перенастройка единицы измерения: kg (кг)/lb (фунты)/st (стоуны). Размеры (ШхВxД): 33x2.0x32 см.</p>";"<p>Напольные весы со стеклянной платформой с оригинальным дизайном MaterialLine (покрытие из ламината).</p>";"Напольные весы Beurer GS21 Mauritius";"";"";"116-210-thickbox_small.jpg,116-210-thickbox_medium.jpg,116-210-thickbox.jpg";"";"";"";"";"";"";"";"";"";""
"1012_117";"Электронные напольные весы BOSCH PPW 3300";"55.00";100;"<p>Электронные весы AxxenceSlim Line. Ультратонкие, высота 17мм с большим дисплеем - 38 мм. Цвет белый.</p>";"<p>Электронные весы AxxenceSlim Line. Ультратонкие, высота 17мм с большим дисплеем - 38 мм. Цвет белый.</p>";"Электронные напольные весы BOSCH PPW 3300";"";"";"117-211-thickbox_small.jpg,117-211-thickbox_medium.jpg,117-211-thickbox.jpg";"";"";"";"";"";"";"";"";"";""
0;;!второй уровень;;;;;;;;;;;;;;;;
"1017_114";"Электробритва PHILIPS RQ 1095";"370.00";100;"<p>Электробритва с ЖК-дисплеем. Бритвенный блок. Индикатор необходимости замены бритвенного блока. Быстрая зарядка. Дорожная блокировка. Индикация очистки. Полированный стальной корпус. Отсутствие вибраций. Антикоррозийное покрытие головок. Можно мыть под водой и бриться с пеной. Система Flex & Pivot: три гибкие головки, вращающиеся в разных направления. Система Lift & Cut.</p>";"<p>Электробритва с ЖК-дисплеем. Бритвенный блок.</p>";"Электробритва PHILIPS RQ 1095";"";"";"114-207-thickbox_small.jpg,114-207-thickbox_medium.jpg,114-207-thickbox.jpg";"";"";"";"";"";"";"";"";"";""
0;;!!третий уровень;;;;;;;;;;;;;;;;
"1018_112";"Гидромассажная ванна для ног BEURER FB25";"89.00";100;"<p>Гидромассажная ванночка для ног с механическим управлением и тремя режимами работы. 16 встроенных магнитов. Вибрационный массаж, вихревой массаж. Дополнительная функция: поддержание температуры воды.</p>";"<p>Гидромассажная ванночка для ног с механическим управлением и тремя режимами работы.</p>";"Гидромассажная ванна для ног BEURER FB25";"";"";"112-205-thickbox_small.jpg,112-205-thickbox_medium.jpg,112-205-thickbox.jpg";"";"";"";"";"";"";"";"";"";""
"1018_113";"Фен-расческа Braun Steam & Style ASS 1000";"83.00";100;"<p>Мощный стайлер с управлямой подачей пара. Мягкая укладка и длительный результат. Идеален для укладки влажных волос и корректировки прически на сухих волосах, для создания локонов и волн, создания объема. 3 ступени мощности потока воздуха. Насадка для создания крупных локонов и волн. Насадка для мелкой и средней завивки. Насадка для подъема волос и создания объема от самых корней. Цвет сиреневый матовый.</p>";"<p>Мощный стайлер с управлямой подачей пара.</p>";"Фен-расческа Braun Steam & Style ASS 1000";"";"";"113-206-thickbox_small.jpg,113-206-thickbox_medium.jpg,113-206-thickbox.jpg";"";"";"";"";"";"";"";"";"";""
0;;Четыре уровня вложенности;;;;;;;;;;;;;;;;
"1013_126";"Фен Valera Swiss Nano 9200 Ionic Tourmaline Rotocord";"123.00";100;"<p>Фен мощностью 2000 Вт. 6 комбинаций температуры и скорости воздушного потока. Независимая регулировка нагрева и воздушного потока. Подача холодного воздуха. Ионизация. Срок службы: 2000 часов. Вес без кабеля: 540 гр. Гибкий кабель 3 м с устройством Rotocord (вращение шнура вокруг своей оси).</p>";"<p>Фен мощностью 2000 Вт. 6 комбинаций температуры и скорости воздушного потока.</p>";"Фен Valera Swiss Nano 9200 Ionic Tourmaline Rotocord";"";"";"126-221-thickbox_small.jpg,126-221-thickbox_medium.jpg,126-221-thickbox.jpg";"";"";"";"";"";"";"";"";"";""
0;;!второй уровень вложенности;;;;;;;;;;;;;;;;
