"cat";"num";"act ";"name";"prc";"brd";"shdesc";"desc";"mimg";"simg";"modim";"modis"
"Нецелые цены";"64";1;"Пневмогайковерт Force 82565";"800.80";"";"<p>Скорость вращения 6000 об/мин, максимальное усилие 1800 Нм, вес 4.4 кг.</p>";"<p>Скорость вращения 6000 об/мин, максимальное усилие 1800 Нм, вес 4.4 кг.</p>";"64-115-thickbox.jpg";"64-115-thickbox.jpg";"64-115-thickbox.jpg";"64-115-thickbox.jpg"
"Нецелые цены";"66";1;"Скобозабиватель Metabo Ta E 2019";"290.99";"";"<p>Модель для работы со скобами, гвоздями, профильными захватами Metabo.</p>";"<p>Модель для работы со скобами, гвоздями, профильными захватами Metabo. Подходит также для работы со скобами из плоской проволоки. Энергия удара может плавно регулироваться электронным образом. Возможность дополнительного добивания (для скоб и гвоздей). Выступ с выемкой для точного позиционирования. Защита от случайного срабатывания удара.</p>";"66-117-thickbox.jpg";"66-117-thickbox.jpg";"66-117-thickbox.jpg";"66-117-thickbox.jpg"
"Нецелые цены";"70";1;"Ленточная шлифовальная машина Dewalt DW432";"360.39";"";"<p>Мощный 800 Вт электродвигатель обеспечивает высокую эффективность шлифования разных материалов.</p>";"<p>Мощный 800 Вт электродвигатель обеспечивает высокую эффективность шлифования разных материалов. Конструкция подошвы из трех роликов обеспечивает лучший контакт шлифленты с обрабатываемой поверхностью. Эффективная система пылеудаления со встроенным пылесборником и возможностью подключения внешнего пылесоса. Две рукоятки для лучшего баланса и контроля.</p>";"70-124-thickbox.jpg";"70-124-thickbox.jpg";"70-124-thickbox.jpg";"70-124-thickbox.jpg"
"Нецелые цены";"74";1;"Bluetooth гарнитура Nokia BH-903";"135.50";"";"<p>Привлекательный дизайн, оснащена дисплеем, который позволяет контролировать музыку.</p>";"<p>Привлекательный дизайн, оснащена дисплеем, который позволяет контролировать музыку. С беспроводной гарнитурой Вы можете: получить отличное качество звука благодаря цифровой обработке сигнала; наслаждаться встроенным FM-радио; управлять музыкой благодаря медиа-клавишам; автоматически переключаться между музыкой и вызовами; слушать музыку или радио и разговаривать до 9 часов после 20 минут зарядки; управлять вызовами; совершать вызовы с гарнитуры через быстрый набор номера на вашем мобильном устройстве.</p>";"74-134-thickbox.jpg";"74-134-thickbox.jpg";"74-134-thickbox.jpg";"74-134-thickbox.jpg"
"Нецелые цены";"78";1;"Блок расширения для AriaSOHO LG-Nortel AR-EKSU";"360.79";"";"<p>Блок расширения для ARIA SOHO, подключается внешней шиной к базовому блоку. В блоке расширения есть - 3 внешние линии; 8 внутренних гибридных абонентов (или аналоговых или цифровых); 1 слот для установки дополнительной платы расширения; 1 аварийный датчик; 1 реле общего назначения; 1 схема аварийного переключение при пропадании питания.</p>";"<p>Блок расширения для ARIA SOHO, подключается внешней шиной к базовому блоку. В блоке расширения есть - 3 внешние линии; 8 внутренних гибридных абонентов (или аналоговых или цифровых); 1 слот для установки дополнительной платы расширения; 1 аварийный датчик; 1 реле общего назначения; 1 схема аварийного переключение при пропадании питания.</p>";"78-138-thickbox.jpg";"78-138-thickbox.jpg";"78-138-thickbox.jpg";"78-138-thickbox.jpg"
"Нецелые цены";"88";1;"Проводной телефон LG GS-475 RUS WA";"35.45";"";"<p>Тоновый / импульсный набор.Память на 3 номера. Функции: регулировка уровня громкости мелодии звонка; сброс набора или соединения (клавиша FLASH); пауза во время разговора (клавиша PAUSE); повторный набор номера (клавиша REDIAL).</p>";"<p>Тоновый / импульсный набор.Память на 3 номера. Функции: регулировка уровня громкости мелодии звонка; сброс набора или соединения (клавиша FLASH); пауза во время разговора (клавиша PAUSE); повторный набор номера (клавиша REDIAL).</p>";"88-153-thickbox.jpg";"88-153-thickbox.jpg";"88-153-thickbox.jpg";"88-153-thickbox.jpg"
"Нецелые цены";"83";1;"IP-телефон D-link DPH-400S";"124.50";"";"<p>Телефонный аппарат позволяет совершать звонки, используя сеть Интернет или корпоративную сеть вместо традиционной телефонной сети общего пользования.</p>";"<p>Телефонный аппарат позволяет совершать звонки, используя сеть Интернет или корпоративную сеть вместо традиционной телефонной сети общего пользования. При этом голос преобразуется в IP-пакеты и передается по сети. Голос и данные могут одновременно передаваться по одному и тому же каналу связи. Телефон снабжен дополнительным разъемом RJ-45 для подключения к порту Ethernet компьютера или локальной сети (через коммутатор или концентратор Fast Ethernet). Это позволяет разговаривать по IP-телефону во время просмотра Web-страниц, отправки почтовых сообщений и выполнения других сетевых задач. Также DPH-400S можно использовать в локальных сетях с поддержкой Ethernet и протокола IP.</p>";"83-147-thickbox.jpg";"83-147-thickbox.jpg";"83-147-thickbox.jpg";"83-147-thickbox.jpg"
"Нецелые цены";"87";1;"Проводной телефон PANASONIC KX-TS2365RUB";"50.55";"";"<p>Проводной телефон PANASONIC оснащен ЖК-дисплеем с часами, функцией громкая связь, портом для дополнительного оборудования, разъемом для гарнитуры. Однокнопочный набор на 20 номеров и ускоренный набор на 10 номеров экономят время.</p>";"<p>Проводной телефон PANASONIC оснащен ЖК-дисплеем с часами, функцией громкая связь, портом для дополнительного оборудования, разъемом для гарнитуры. Однокнопочный набор на 20 номеров и ускоренный набор на 10 номеров экономят время. Есть кнопка пауза, ограничение и блокировка вызова, возможность регулировать громкость звонка и динамика, мелодия в режиме удержания соединения, выключение микрофона. Возможна установка на стене. Цвет модели - черный.</p>";"87-152-thickbox.jpg";"87-152-thickbox.jpg";"87-152-thickbox.jpg";"87-152-thickbox.jpg"
"Нецелые цены";"90";1;"Факсимильный аппарат Sharp UX-73";"220.22";"";"<p>Простой и удобный в эксплуатации факсимильный аппарат с памятью, достаточной для хранения 17 страниц.</p>";"<p>Простой и удобный в эксплуатации факсимильный аппарат с памятью, достаточной для хранения 17 страниц. Факс, копир и телефон, собранные вместе в компактном корпусе. Печать на термобумаге. Скорость модема - до 9,6 Кбит/с. Автоподатчик на 10 листов. Автоматический набор 40 номеров. Автоматическая обрезка бумаги.</p>";"90-155-thickbox.jpg";"90-155-thickbox.jpg";"90-155-thickbox.jpg";"90-155-thickbox.jpg"
"Электронные товары";"138";1;"Парсер товаров Яндекс Маркета";"54.99";"";"<p>Парсер Яндекс-Маркет – отдельная и специальная сборка парсера Catalog Loader для скачивания товаров из торговой площадки Яндекс-Маркет.</p>";"<p>Парсер Яндекс-Маркет – отдельная и специальная сборка парсера Catalog Loader для скачивания товаров из торговой площадки Яндекс-Маркет. Преимущества парсера Яндекс-Маркет перед аналогами: - Программа работает под Windows (XP / 7 / 2003 / 2008). - Установка программы не требует никаких специальных знаний и навыков, устанавливается как обычное приложение Windows (далее, далее… готово). - Максимально упрощенный и понятный интерфейс. Параметры, которые извлекаются парсером Яндекс-Маркет в стандартной конфигурации: - структура каталога; - имя товара; - цена товара; - краткое описание; - полное описание (в виде одной таблицы); - 1 основное (если отсутствует увеличенное изображение, берется маленькое)﻿ + 3 дополнительных изображения; - производитель;﻿ - meta_title﻿, meta_description﻿, meta_keywords;﻿﻿ - возможно расширение стандартной версии дополнительными параметрами и возможностями (изменение цены по формуле, разбиение описания на характеристики и т.д.). Копирование товаров происходит с задержкой (в избежании бана), поддержка прокси-серверов. Экспорт товаров парсером Яндекс-Маркет происходит в csv для следующих CMS: - PrestaShop, - VamShop, - Virtuemart(Joomla), - ShopScript, - ShopCMS - ABO, - Amiro, - PhpShop, - HostCMS, - TomatoCart﻿, - CS-Cart﻿﻿, - возможно подключение любой другой CMS или нужного формата csv (бесплатно). Возможность возобновления процесса парсинга с предыдущего состояние в случае какого-либо сбоя (выкл. электричества и т.п. ) или ручной остановки парсера. После оформления заказа Вам будет выслана ссылка на скачивание программы, а так ﻿же логин и пароль для запуска программы (в будние дни логин и пароль высылается в течении 5-45 мин после поступления оплаты, в выходные дни возможна задержка в несколько часов). Парсер копирует товары, информация о которых размещена на Я.Маркет. Товары, для которых предоставлены только анонсы со ссылками на другие источники не копируются. Постоянное бесплатное обновление сборки парсера.</p><p>Наш продукт ShopDataGetway - это система предоставляющая вашим партнерам возможность мгновенно обновлять интернет-магазины используя данные из ваших систем. Система предоставляет вашим партнерам данные в требуемом им виде. С помощью продукта ShopDataGetway вы позволяете вашим партнерам избежать лишних затрат на автоматизицию бизнес-процессов.</p><p>CatalogLoader– это пакет программного обеспечение, представляющее собой набор инструментов для работы с товарамиинтернет-магазинов (парсер, автоматическое наполнение, изменение цен, обработка склада, мониторинг конкурентов).</p>";"138-247-thickbox.jpg";"138-247-thickbox.jpg";"138-247-thickbox.jpg";"138-247-thickbox.jpg"
"Электронные товары";"139";1;"Парсер товаров focalprice.com";"79.00";"";"<p>Парсер focalprice.com – отдельная и специальная сборка парсера Catalog Loader для скачивания товаров из интернет-магазина focalprice.com.</p><p>Преимущества парсера focalprice.com перед аналогами:</p>";"<p>Парсер focalprice.com – отдельная и специальная сборка парсера Catalog Loader для скачивания товаров из интернет-магазина focalprice.com.</p><p>Преимущества парсера focalprice.com перед аналогами: - Программа работает под Windows (XP / 7 / 2003 / 2008). - Установка программы не требует никаких специальных знаний и навыков, устанавливается как обычное приложение Windows (далее, далее… готово). - Максимально упрощенный и понятный интерфейс. Парсером focalprice.com извлекается: - Структура каталога - Имя товара - Артикул - Краткое описание товара (в качестве краткого описания Имя товара) - Полное описание товара (без разбиения на параметры, ссылки (ссылки на картинки) в тексте описания удаляются) - Изображение (1-6шт.) - Цена (если имеется скидка на товара, берется цена по скидке) - meta_title﻿, meta_description﻿, meta_keywords;﻿ - Возможно расширение стандартной версии дополнительными параметрами и возможностями (изменение цены по формуле, разбиение описания на характеристики, мониторинг и сравнение цен и т.д.). Экспорт товаров парсером focalprice.com происходит в csv для следующих CMS: - PrestaShop, - VamShop, - Virtuemart(Joomla), - ShopScript, - ABO, - Amiro, - PhpShop, - HostCMS, - возможно подключение любой другой CMS или нужного формата csv (бесплатно). Возможность возобновления процесса парсинга с предыдущего состояние в случае какого-либо сбоя (выкл. электричества и т.п. ) или ручной остановки парсера. После оформления заказа Вам будет выслана ссылка на скачивание программы.</p><p>Наш продукт ShopDataGetway - это система предоставляющая вашим партнерам возможность мгновенно обновлять интернет-магазины используя данные из ваших систем. Система предоставляет вашим партнерам данные в требуемом им виде. С помощью продукта ShopDataGetway вы позволяете вашим партнерам избежать лишних затрат на автоматизицию бизнес-процессов.</p><p>CatalogLoader– это пакет программного обеспечение, представляющее собой набор инструментов для работы с товарамиинтернет-магазинов (парсер, автоматическое наполнение, изменение цен, обработка склада, мониторинг конкурентов).</p>";"139-252-thickbox.jpg";"139-252-thickbox.jpg";"139-252-thickbox.jpg";"139-252-thickbox.jpg"
"Электронные товары";"140";1;"Парсер товаров zappos.com";"159.00";"";"<p>Парсер zappos.com﻿﻿ – отдельная и специальная сборка парсера Catalog Loader для скачивания товаров из zappos.com﻿.</p>";"<p>Парсер zappos.com﻿﻿ – отдельная и специальная сборка парсера Catalog Loader для скачивания товаров из zappos.com﻿.</p><p>Парсер товаров из интернет-магазина zappos.com очень быстро и качественно наполнит Ваш интернет-магазин всем представленым там ассортиментом.</p><p>Вы должны выбрать именно этот парсер zappos.com, т.к. он имеет ряд преимуществ перед аналогами, например:</p><p>- Программа работает под Windows (XP / 7 / 2003 / 2008).</p><p>- Устанавливается быстро и не потребует от Вас каких-либо дополнительных знаний ПК.</p><p>- Специально для Вас интерфейс программы максимально упрощён и будет понятен даже неопытному пользователю.</p><p>В обычной сборке прасер интернет-магазина zappos.com извлекает следующие параметры:</p><p>- структуру каталога;</p><p>- имя товара;</p><p>- цену товара;</p><p>- краткое описание;</p><p>- полное описание;</p><p>- изображение (увеличенное);</p><p>- meta_title﻿, meta_description﻿, meta_keywords;</p><p>- дополнительно осуществляется расширение стандартной версии желаемыми параметрами и возможностями (изменение цены по формуле, мониторинг и сравнение цен и т.д.).</p><p>Товары экспортируются в csv для следующих CMS:</p><p>- PrestaShop,</p><p>- VamShop,</p><p>- Virtuemart(Joomla),</p><p>- ShopScript,</p><p>- ABO,</p><p>- Amiro,</p><p>- PhpShop,</p><p>- HostCMS,﻿</p><p>- бесплатно подключается любая другая CMSили нужный формат csv.</p><p>Программа возобновляет процесс парсинга с состояния разрыва при любом сбое (выкл. электричества и т.д.).</p><p>После оформления заказа Вам будет выслана ссылка на скачивание программы. ﻿</p><p>Наш продукт ShopDataGetway - это система предоставляющая вашим партнерам возможность мгновенно обновлять интернет-магазины используя данные из ваших систем. Система предоставляет вашим партнерам данные в требуемом им виде. С помощью продукта ShopDataGetway вы позволяете вашим партнерам избежать лишних затрат на автоматизицию бизнес-процессов.</p><p>CatalogLoader– это пакет программного обеспечение, представляющее собой набор инструментов для работы с товарамиинтернет-магазинов (парсер, автоматическое наполнение, изменение цен, обработка склада, мониторинг конкурентов).</p>";"140-255-thickbox.jpg";"140-255-thickbox.jpg";"140-255-thickbox.jpg";"140-255-thickbox.jpg"
